log|documents|idx_log_documents_number|CREATE INDEX idx_log_documents_number ON log.documents USING btree (document_number)|f
log|documents|idx_log_documents_status|CREATE INDEX idx_log_documents_status ON log.documents USING btree (status)|f
log|documents|idx_log_documents_tenant_id|CREATE INDEX idx_log_documents_tenant_id ON log.documents USING btree (tenant_id)|f
log|documents|idx_log_documents_type_id|CREATE INDEX idx_log_documents_type_id ON log.documents USING btree (document_type_id)|f
log|driver_certifications|idx_log_driver_certs_driver_id|CREATE INDEX idx_log_driver_certs_driver_id ON log.driver_certifications USING btree (driver_id)|f
log|driver_certifications|idx_log_driver_certs_status|CREATE INDEX idx_log_driver_certs_status ON log.driver_certifications USING btree (status)|f
log|driver_certifications|idx_log_driver_certs_tenant_id|CREATE INDEX idx_log_driver_certs_tenant_id ON log.driver_certifications USING btree (tenant_id)|f
log|driver_certifications|idx_log_driver_certs_type|CREATE INDEX idx_log_driver_certs_type ON log.driver_certifications USING btree (certification_type)|f
log|driver_hos|driver_hos_driver_id_log_date_duty_status_status_start_time_key|CREATE UNIQUE INDEX driver_hos_driver_id_log_date_duty_status_status_start_time_key ON log.driver_hos USING btree (driver_id, log_date, duty_status, status_start_time)|t
log|driver_hos|idx_log_driver_hos_driver_id|CREATE INDEX idx_log_driver_hos_driver_id ON log.driver_hos USING btree (driver_id)|f
log|driver_hos|idx_log_driver_hos_duty_status|CREATE INDEX idx_log_driver_hos_duty_status ON log.driver_hos USING btree (duty_status)|f
log|driver_hos|idx_log_driver_hos_log_date|CREATE INDEX idx_log_driver_hos_log_date ON log.driver_hos USING btree (log_date)|f
log|driver_hos|idx_log_driver_hos_tenant_id|CREATE INDEX idx_log_driver_hos_tenant_id ON log.driver_hos USING btree (tenant_id)|f
log|driver_hos|idx_log_driver_hos_violation|CREATE INDEX idx_log_driver_hos_violation ON log.driver_hos USING btree (is_violation)|f
log|driver_payroll|idx_log_driver_payroll_driver_id|CREATE INDEX idx_log_driver_payroll_driver_id ON log.driver_payroll USING btree (driver_id)|f
log|driver_payroll|idx_log_driver_payroll_period|CREATE INDEX idx_log_driver_payroll_period ON log.driver_payroll USING btree (pay_period_start, pay_period_end)|f
log|driver_payroll|idx_log_driver_payroll_status|CREATE INDEX idx_log_driver_payroll_status ON log.driver_payroll USING btree (status)|f
log|driver_payroll|idx_log_driver_payroll_tenant_id|CREATE INDEX idx_log_driver_payroll_tenant_id ON log.driver_payroll USING btree (tenant_id)|f
log|driver_training|idx_log_driver_training_completion|CREATE INDEX idx_log_driver_training_completion ON log.driver_training USING btree (completion_date)|f
log|driver_training|idx_log_driver_training_driver_id|CREATE INDEX idx_log_driver_training_driver_id ON log.driver_training USING btree (driver_id)|f
log|driver_training|idx_log_driver_training_tenant_id|CREATE INDEX idx_log_driver_training_tenant_id ON log.driver_training USING btree (tenant_id)|f
log|driver_training|idx_log_driver_training_type|CREATE INDEX idx_log_driver_training_type ON log.driver_training USING btree (training_type)|f
log|drivers|drivers_driver_code_key|CREATE UNIQUE INDEX drivers_driver_code_key ON log.drivers USING btree (driver_code)|t
log|drivers|idx_log_drivers_code|CREATE INDEX idx_log_drivers_code ON log.drivers USING btree (driver_code)|f
log|drivers|idx_log_drivers_employee_number|CREATE INDEX idx_log_drivers_employee_number ON log.drivers USING btree (employee_number)|f
log|drivers|idx_log_drivers_license_number|CREATE INDEX idx_log_drivers_license_number ON log.drivers USING btree (license_number)|f
log|drivers|idx_log_drivers_status|CREATE INDEX idx_log_drivers_status ON log.drivers USING btree (status)|f
log|drivers|idx_log_drivers_tenant_id|CREATE INDEX idx_log_drivers_tenant_id ON log.drivers USING btree (tenant_id)|f
log|equipment|equipment_asset_number_key|CREATE UNIQUE INDEX equipment_asset_number_key ON log.equipment USING btree (asset_number)|t
log|equipment|idx_log_equipment_asset_number|CREATE INDEX idx_log_equipment_asset_number ON log.equipment USING btree (asset_number)|f
log|equipment|idx_log_equipment_status|CREATE INDEX idx_log_equipment_status ON log.equipment USING btree (status)|f
log|equipment|idx_log_equipment_tenant_id|CREATE INDEX idx_log_equipment_tenant_id ON log.equipment USING btree (tenant_id)|f
log|equipment|idx_log_equipment_type_id|CREATE INDEX idx_log_equipment_type_id ON log.equipment USING btree (equipment_type_id)|f
log|equipment|idx_log_equipment_vin|CREATE INDEX idx_log_equipment_vin ON log.equipment USING btree (vin)|f
log|equipment_assignments|idx_log_eq_assignments_assigned_to|CREATE INDEX idx_log_eq_assignments_assigned_to ON log.equipment_assignments USING btree (assigned_to_id, assigned_to_type)|f
log|equipment_assignments|idx_log_eq_assignments_equip_id|CREATE INDEX idx_log_eq_assignments_equip_id ON log.equipment_assignments USING btree (equipment_id)|f
log|equipment_assignments|idx_log_eq_assignments_tenant_id|CREATE INDEX idx_log_eq_assignments_tenant_id ON log.equipment_assignments USING btree (tenant_id)|f
log|equipment_assignments|idx_log_eq_assignments_type|CREATE INDEX idx_log_eq_assignments_type ON log.equipment_assignments USING btree (assignment_type)|f
log|equipment_tracking_devices|equipment_tracking_devices_device_serial_key|CREATE UNIQUE INDEX equipment_tracking_devices_device_serial_key ON log.equipment_tracking_devices USING btree (device_serial)|t
log|equipment_tracking_devices|idx_log_eq_tracking_devices_eq_id|CREATE INDEX idx_log_eq_tracking_devices_eq_id ON log.equipment_tracking_devices USING btree (equipment_id)|f
log|equipment_tracking_devices|idx_log_eq_tracking_devices_serial|CREATE INDEX idx_log_eq_tracking_devices_serial ON log.equipment_tracking_devices USING btree (device_serial)|f
log|equipment_tracking_devices|idx_log_eq_tracking_devices_status|CREATE INDEX idx_log_eq_tracking_devices_status ON log.equipment_tracking_devices USING btree (status)|f
log|equipment_tracking_devices|idx_log_eq_tracking_devices_tenant_id|CREATE INDEX idx_log_eq_tracking_devices_tenant_id ON log.equipment_tracking_devices USING btree (tenant_id)|f
log|equipment_types|equipment_types_equipment_type_code_key|CREATE UNIQUE INDEX equipment_types_equipment_type_code_key ON log.equipment_types USING btree (equipment_type_code)|t
log|equipment_types|idx_log_equipment_types_category|CREATE INDEX idx_log_equipment_types_category ON log.equipment_types USING btree (equipment_category)|f
log|equipment_types|idx_log_equipment_types_code|CREATE INDEX idx_log_equipment_types_code ON log.equipment_types USING btree (equipment_type_code)|f
log|equipment_types|idx_log_equipment_types_tenant_id|CREATE INDEX idx_log_equipment_types_tenant_id ON log.equipment_types USING btree (tenant_id)|f
log|freight_audit|idx_log_freight_audit_date|CREATE INDEX idx_log_freight_audit_date ON log.freight_audit USING btree (audit_date)|f
log|freight_audit|idx_log_freight_audit_invoice_id|CREATE INDEX idx_log_freight_audit_invoice_id ON log.freight_audit USING btree (freight_invoice_id)|f
log|freight_audit|idx_log_freight_audit_result|CREATE INDEX idx_log_freight_audit_result ON log.freight_audit USING btree (result)|f
log|freight_audit|idx_log_freight_audit_tenant_id|CREATE INDEX idx_log_freight_audit_tenant_id ON log.freight_audit USING btree (tenant_id)|f
log|freight_cost_allocations|idx_log_freight_cost_alloc_line_id|CREATE INDEX idx_log_freight_cost_alloc_line_id ON log.freight_cost_allocations USING btree (freight_cost_line_id)|f
log|freight_cost_allocations|idx_log_freight_cost_alloc_load_line|CREATE INDEX idx_log_freight_cost_alloc_load_line ON log.freight_cost_allocations USING btree (load_line_id)|f
log|freight_cost_allocations|idx_log_freight_cost_alloc_ship_line|CREATE INDEX idx_log_freight_cost_alloc_ship_line ON log.freight_cost_allocations USING btree (shipment_line_id)|f
log|freight_cost_allocations|idx_log_freight_cost_alloc_tenant_id|CREATE INDEX idx_log_freight_cost_alloc_tenant_id ON log.freight_cost_allocations USING btree (tenant_id)|f
log|freight_cost_lines|freight_cost_lines_freight_cost_id_line_number_key|CREATE UNIQUE INDEX freight_cost_lines_freight_cost_id_line_number_key ON log.freight_cost_lines USING btree (freight_cost_id, line_number)|t
log|freight_cost_lines|idx_log_freight_cost_lines_cost_id|CREATE INDEX idx_log_freight_cost_lines_cost_id ON log.freight_cost_lines USING btree (freight_cost_id)|f
log|freight_cost_lines|idx_log_freight_cost_lines_tenant_id|CREATE INDEX idx_log_freight_cost_lines_tenant_id ON log.freight_cost_lines USING btree (tenant_id)|f
log|freight_costs|idx_log_freight_costs_category|CREATE INDEX idx_log_freight_costs_category ON log.freight_costs USING btree (cost_category)|f
log|freight_costs|idx_log_freight_costs_date|CREATE INDEX idx_log_freight_costs_date ON log.freight_costs USING btree (cost_date)|f
log|freight_costs|idx_log_freight_costs_load_id|CREATE INDEX idx_log_freight_costs_load_id ON log.freight_costs USING btree (load_id)|f
log|freight_costs|idx_log_freight_costs_shipment_id|CREATE INDEX idx_log_freight_costs_shipment_id ON log.freight_costs USING btree (shipment_id)|f
log|freight_costs|idx_log_freight_costs_tenant_id|CREATE INDEX idx_log_freight_costs_tenant_id ON log.freight_costs USING btree (tenant_id)|f
log|freight_invoice_lines|freight_invoice_lines_freight_invoice_id_line_number_key|CREATE UNIQUE INDEX freight_invoice_lines_freight_invoice_id_line_number_key ON log.freight_invoice_lines USING btree (freight_invoice_id, line_number)|t
log|freight_invoice_lines|idx_log_freight_inv_lines_invoice_id|CREATE INDEX idx_log_freight_inv_lines_invoice_id ON log.freight_invoice_lines USING btree (freight_invoice_id)|f
log|freight_invoice_lines|idx_log_freight_inv_lines_tenant_id|CREATE INDEX idx_log_freight_inv_lines_tenant_id ON log.freight_invoice_lines USING btree (tenant_id)|f
log|freight_invoices|freight_invoices_invoice_number_key|CREATE UNIQUE INDEX freight_invoices_invoice_number_key ON log.freight_invoices USING btree (invoice_number)|t
log|freight_invoices|idx_log_freight_invoices_carrier_id|CREATE INDEX idx_log_freight_invoices_carrier_id ON log.freight_invoices USING btree (carrier_id)|f
log|freight_invoices|idx_log_freight_invoices_date|CREATE INDEX idx_log_freight_invoices_date ON log.freight_invoices USING btree (invoice_date)|f
log|freight_invoices|idx_log_freight_invoices_load_id|CREATE INDEX idx_log_freight_invoices_load_id ON log.freight_invoices USING btree (load_id)|f
log|freight_invoices|idx_log_freight_invoices_number|CREATE INDEX idx_log_freight_invoices_number ON log.freight_invoices USING btree (invoice_number)|f
log|freight_invoices|idx_log_freight_invoices_shipment_id|CREATE INDEX idx_log_freight_invoices_shipment_id ON log.freight_invoices USING btree (shipment_id)|f
log|freight_invoices|idx_log_freight_invoices_status|CREATE INDEX idx_log_freight_invoices_status ON log.freight_invoices USING btree (status)|f
log|freight_invoices|idx_log_freight_invoices_tenant_id|CREATE INDEX idx_log_freight_invoices_tenant_id ON log.freight_invoices USING btree (tenant_id)|f
log|fuel_consumption|idx_log_fuel_consumption_period|CREATE INDEX idx_log_fuel_consumption_period ON log.fuel_consumption USING btree (period_start, period_end)|f
log|fuel_consumption|idx_log_fuel_consumption_tenant_id|CREATE INDEX idx_log_fuel_consumption_tenant_id ON log.fuel_consumption USING btree (tenant_id)|f
log|fuel_consumption|idx_log_fuel_consumption_trip_id|CREATE INDEX idx_log_fuel_consumption_trip_id ON log.fuel_consumption USING btree (trip_id)|f
log|fuel_consumption|idx_log_fuel_consumption_vehicle_id|CREATE INDEX idx_log_fuel_consumption_vehicle_id ON log.fuel_consumption USING btree (vehicle_id)|f
log|fuel_surcharge_lines|idx_log_fuel_surcharge_lines_table_id|CREATE INDEX idx_log_fuel_surcharge_lines_table_id ON log.fuel_surcharge_lines USING btree (fuel_surcharge_table_id)|f
log|fuel_surcharge_lines|idx_log_fuel_surcharge_lines_tenant_id|CREATE INDEX idx_log_fuel_surcharge_lines_tenant_id ON log.fuel_surcharge_lines USING btree (tenant_id)|f
log|fuel_surcharge_tables|fuel_surcharge_tables_table_code_key|CREATE UNIQUE INDEX fuel_surcharge_tables_table_code_key ON log.fuel_surcharge_tables USING btree (table_code)|t
log|fuel_surcharge_tables|idx_log_fuel_surcharge_tables_carrier_id|CREATE INDEX idx_log_fuel_surcharge_tables_carrier_id ON log.fuel_surcharge_tables USING btree (carrier_id)|f
log|fuel_surcharge_tables|idx_log_fuel_surcharge_tables_code|CREATE INDEX idx_log_fuel_surcharge_tables_code ON log.fuel_surcharge_tables USING btree (table_code)|f
log|fuel_surcharge_tables|idx_log_fuel_surcharge_tables_tenant_id|CREATE INDEX idx_log_fuel_surcharge_tables_tenant_id ON log.fuel_surcharge_tables USING btree (tenant_id)|f
log|fuel_transactions|fuel_transactions_transaction_number_key|CREATE UNIQUE INDEX fuel_transactions_transaction_number_key ON log.fuel_transactions USING btree (transaction_number)|t
log|fuel_transactions|idx_log_fuel_transactions_date|CREATE INDEX idx_log_fuel_transactions_date ON log.fuel_transactions USING btree (fuel_date)|f
log|fuel_transactions|idx_log_fuel_transactions_driver_id|CREATE INDEX idx_log_fuel_transactions_driver_id ON log.fuel_transactions USING btree (driver_id)|f
log|fuel_transactions|idx_log_fuel_transactions_tenant_id|CREATE INDEX idx_log_fuel_transactions_tenant_id ON log.fuel_transactions USING btree (tenant_id)|f
log|fuel_transactions|idx_log_fuel_transactions_vehicle_id|CREATE INDEX idx_log_fuel_transactions_vehicle_id ON log.fuel_transactions USING btree (vehicle_id)|f
log|geofence_events|idx_log_geofence_events_tenant_id|CREATE INDEX idx_log_geofence_events_tenant_id ON log.geofence_events USING btree (tenant_id)|f
log|geofence_events|idx_log_geofence_events_timestamp|CREATE INDEX idx_log_geofence_events_timestamp ON log.geofence_events USING btree (event_timestamp)|f
log|geofence_events|idx_log_geofence_events_tracking_event_id|CREATE INDEX idx_log_geofence_events_tracking_event_id ON log.geofence_events USING btree (tracking_event_id)|f
log|geofence_events|idx_log_geofence_events_type|CREATE INDEX idx_log_geofence_events_type ON log.geofence_events USING btree (event_type)|f
log|gps_pings|idx_log_gps_pings_equipment_id|CREATE INDEX idx_log_gps_pings_equipment_id ON log.gps_pings USING btree (equipment_id)|f
log|gps_pings|idx_log_gps_pings_load_id|CREATE INDEX idx_log_gps_pings_load_id ON log.gps_pings USING btree (load_id)|f
log|gps_pings|idx_log_gps_pings_tenant_id|CREATE INDEX idx_log_gps_pings_tenant_id ON log.gps_pings USING btree (tenant_id)|f
log|gps_pings|idx_log_gps_pings_timestamp|CREATE INDEX idx_log_gps_pings_timestamp ON log.gps_pings USING btree (ping_timestamp)|f
log|gps_pings|idx_log_gps_pings_vehicle_id|CREATE INDEX idx_log_gps_pings_vehicle_id ON log.gps_pings USING btree (vehicle_id)|f
log|hazmat_classifications|hazmat_classifications_class_code_key|CREATE UNIQUE INDEX hazmat_classifications_class_code_key ON log.hazmat_classifications USING btree (class_code)|t
log|hazmat_classifications|idx_log_hazmat_class_class|CREATE INDEX idx_log_hazmat_class_class ON log.hazmat_classifications USING btree (hazard_class)|f
log|hazmat_classifications|idx_log_hazmat_class_code|CREATE INDEX idx_log_hazmat_class_code ON log.hazmat_classifications USING btree (class_code)|f
log|hazmat_incidents|hazmat_incidents_incident_number_key|CREATE UNIQUE INDEX hazmat_incidents_incident_number_key ON log.hazmat_incidents USING btree (incident_number)|t
log|hazmat_incidents|idx_log_hazmat_incidents_date|CREATE INDEX idx_log_hazmat_incidents_date ON log.hazmat_incidents USING btree (incident_date)|f
log|hazmat_incidents|idx_log_hazmat_incidents_number|CREATE INDEX idx_log_hazmat_incidents_number ON log.hazmat_incidents USING btree (incident_number)|f
log|hazmat_incidents|idx_log_hazmat_incidents_shipment_id|CREATE INDEX idx_log_hazmat_incidents_shipment_id ON log.hazmat_incidents USING btree (shipment_id)|f
log|hazmat_incidents|idx_log_hazmat_incidents_tenant_id|CREATE INDEX idx_log_hazmat_incidents_tenant_id ON log.hazmat_incidents USING btree (tenant_id)|f
log|hazmat_packaging|idx_log_hazmat_packaging_class_id|CREATE INDEX idx_log_hazmat_packaging_class_id ON log.hazmat_packaging USING btree (hazmat_classification_id)|f
log|hazmat_packaging|idx_log_hazmat_packaging_un|CREATE INDEX idx_log_hazmat_packaging_un ON log.hazmat_packaging USING btree (un_number)|f
log|hazmat_segregation|hazmat_segregation_class_a_class_b_key|CREATE UNIQUE INDEX hazmat_segregation_class_a_class_b_key ON log.hazmat_segregation USING btree (class_a, class_b)|t
log|hazmat_segregation|idx_log_hazmat_segregation_class_a|CREATE INDEX idx_log_hazmat_segregation_class_a ON log.hazmat_segregation USING btree (class_a)|f
log|hazmat_segregation|idx_log_hazmat_segregation_class_b|CREATE INDEX idx_log_hazmat_segregation_class_b ON log.hazmat_segregation USING btree (class_b)|f
log|hs_codes|hs_codes_hs_code_key|CREATE UNIQUE INDEX hs_codes_hs_code_key ON log.hs_codes USING btree (hs_code)|t
log|hs_codes|idx_log_hs_codes_chapter|CREATE INDEX idx_log_hs_codes_chapter ON log.hs_codes USING btree (chapter)|f
log|hs_codes|idx_log_hs_codes_code|CREATE INDEX idx_log_hs_codes_code ON log.hs_codes USING btree (hs_code)|f
log|incoterms|idx_log_incoterms_code|CREATE INDEX idx_log_incoterms_code ON log.incoterms USING btree (incoterm_code)|f
log|incoterms|incoterms_incoterm_code_key|CREATE UNIQUE INDEX incoterms_incoterm_code_key ON log.incoterms USING btree (incoterm_code)|t
log|insurance_policies|idx_log_insurance_policies_carrier_id|CREATE INDEX idx_log_insurance_policies_carrier_id ON log.insurance_policies USING btree (carrier_id)|f
log|insurance_policies|idx_log_insurance_policies_status|CREATE INDEX idx_log_insurance_policies_status ON log.insurance_policies USING btree (status)|f
log|insurance_policies|idx_log_insurance_policies_tenant_id|CREATE INDEX idx_log_insurance_policies_tenant_id ON log.insurance_policies USING btree (tenant_id)|f
log|insurance_policies|idx_log_insurance_policies_type|CREATE INDEX idx_log_insurance_policies_type ON log.insurance_policies USING btree (policy_type)|f
log|insurance_policies|insurance_policies_policy_number_key|CREATE UNIQUE INDEX insurance_policies_policy_number_key ON log.insurance_policies USING btree (policy_number)|t
log|interface_error_log|idx_log_iface_error_log_resolved|CREATE INDEX idx_log_iface_error_log_resolved ON log.interface_error_log USING btree (resolved)|f
log|interface_error_log|idx_log_iface_error_log_severity|CREATE INDEX idx_log_iface_error_log_severity ON log.interface_error_log USING btree (severity)|f
log|interface_error_log|idx_log_iface_error_log_source|CREATE INDEX idx_log_iface_error_log_source ON log.interface_error_log USING btree (source_system)|f
log|interface_error_log|idx_log_iface_error_log_tenant_id|CREATE INDEX idx_log_iface_error_log_tenant_id ON log.interface_error_log USING btree (tenant_id)|f
log|interface_shipment_import|idx_log_iface_ship_import_batch_id|CREATE INDEX idx_log_iface_ship_import_batch_id ON log.interface_shipment_import USING btree (batch_id)|f
log|interface_shipment_import|idx_log_iface_ship_import_source|CREATE INDEX idx_log_iface_ship_import_source ON log.interface_shipment_import USING btree (source_system)|f
log|interface_shipment_import|idx_log_iface_ship_import_status|CREATE INDEX idx_log_iface_ship_import_status ON log.interface_shipment_import USING btree (status)|f
log|interface_shipment_import|idx_log_iface_ship_import_tenant_id|CREATE INDEX idx_log_iface_ship_import_tenant_id ON log.interface_shipment_import USING btree (tenant_id)|f
log|kpi_definitions|idx_log_kpi_definitions_category|CREATE INDEX idx_log_kpi_definitions_category ON log.kpi_definitions USING btree (kpi_category)|f
log|kpi_definitions|idx_log_kpi_definitions_code|CREATE INDEX idx_log_kpi_definitions_code ON log.kpi_definitions USING btree (kpi_code)|f
log|kpi_definitions|idx_log_kpi_definitions_tenant_id|CREATE INDEX idx_log_kpi_definitions_tenant_id ON log.kpi_definitions USING btree (tenant_id)|f
log|kpi_definitions|kpi_definitions_kpi_code_key|CREATE UNIQUE INDEX kpi_definitions_kpi_code_key ON log.kpi_definitions USING btree (kpi_code)|t
log|kpi_values|idx_log_kpi_values_carrier_id|CREATE INDEX idx_log_kpi_values_carrier_id ON log.kpi_values USING btree (carrier_id)|f
log|kpi_values|idx_log_kpi_values_def_id|CREATE INDEX idx_log_kpi_values_def_id ON log.kpi_values USING btree (kpi_definition_id)|f
log|kpi_values|idx_log_kpi_values_driver_id|CREATE INDEX idx_log_kpi_values_driver_id ON log.kpi_values USING btree (driver_id)|f
log|kpi_values|idx_log_kpi_values_lane_id|CREATE INDEX idx_log_kpi_values_lane_id ON log.kpi_values USING btree (lane_id)|f
log|kpi_values|idx_log_kpi_values_period|CREATE INDEX idx_log_kpi_values_period ON log.kpi_values USING btree (period_start, period_end)|f
log|kpi_values|idx_log_kpi_values_tenant_id|CREATE INDEX idx_log_kpi_values_tenant_id ON log.kpi_values USING btree (tenant_id)|f
log|lane_carriers|idx_log_lane_carriers_carrier_id|CREATE INDEX idx_log_lane_carriers_carrier_id ON log.lane_carriers USING btree (carrier_id)|f
log|lane_carriers|idx_log_lane_carriers_lane_id|CREATE INDEX idx_log_lane_carriers_lane_id ON log.lane_carriers USING btree (lane_id)|f
log|lane_carriers|idx_log_lane_carriers_preferred|CREATE INDEX idx_log_lane_carriers_preferred ON log.lane_carriers USING btree (is_preferred)|f
log|lane_carriers|idx_log_lane_carriers_tenant_id|CREATE INDEX idx_log_lane_carriers_tenant_id ON log.lane_carriers USING btree (tenant_id)|f
log|lane_carriers|lane_carriers_lane_id_carrier_id_key|CREATE UNIQUE INDEX lane_carriers_lane_id_carrier_id_key ON log.lane_carriers USING btree (lane_id, carrier_id)|t
log|lane_performance|idx_log_lane_perf_carrier_id|CREATE INDEX idx_log_lane_perf_carrier_id ON log.lane_performance USING btree (carrier_id)|f
log|lane_performance|idx_log_lane_perf_lane_id|CREATE INDEX idx_log_lane_perf_lane_id ON log.lane_performance USING btree (lane_id)|f
log|lane_performance|idx_log_lane_perf_period|CREATE INDEX idx_log_lane_perf_period ON log.lane_performance USING btree (period_start, period_end)|f
log|lane_performance|idx_log_lane_perf_tenant_id|CREATE INDEX idx_log_lane_perf_tenant_id ON log.lane_performance USING btree (tenant_id)|f
log|lanes|idx_log_lanes_code|CREATE INDEX idx_log_lanes_code ON log.lanes USING btree (lane_code)|f
log|lanes|idx_log_lanes_destination|CREATE INDEX idx_log_lanes_destination ON log.lanes USING btree (destination_city, destination_state)|f
log|lanes|idx_log_lanes_origin|CREATE INDEX idx_log_lanes_origin ON log.lanes USING btree (origin_city, origin_state)|f
log|lanes|idx_log_lanes_tenant_id|CREATE INDEX idx_log_lanes_tenant_id ON log.lanes USING btree (tenant_id)|f
log|lanes|lanes_lane_code_key|CREATE UNIQUE INDEX lanes_lane_code_key ON log.lanes USING btree (lane_code)|t
log|load_costs|idx_log_load_costs_load_id|CREATE INDEX idx_log_load_costs_load_id ON log.load_costs USING btree (load_id)|f
log|load_costs|idx_log_load_costs_tenant_id|CREATE INDEX idx_log_load_costs_tenant_id ON log.load_costs USING btree (tenant_id)|f
log|load_costs|idx_log_load_costs_type|CREATE INDEX idx_log_load_costs_type ON log.load_costs USING btree (cost_type)|f
log|load_legs|idx_log_load_legs_from_stop|CREATE INDEX idx_log_load_legs_from_stop ON log.load_legs USING btree (from_stop_id)|f
log|load_legs|idx_log_load_legs_load_id|CREATE INDEX idx_log_load_legs_load_id ON log.load_legs USING btree (load_id)|f
log|load_legs|idx_log_load_legs_tenant_id|CREATE INDEX idx_log_load_legs_tenant_id ON log.load_legs USING btree (tenant_id)|f
log|load_legs|idx_log_load_legs_to_stop|CREATE INDEX idx_log_load_legs_to_stop ON log.load_legs USING btree (to_stop_id)|f
log|load_legs|load_legs_load_id_leg_sequence_key|CREATE UNIQUE INDEX load_legs_load_id_leg_sequence_key ON log.load_legs USING btree (load_id, leg_sequence)|t
log|load_lines|idx_log_load_lines_load_id|CREATE INDEX idx_log_load_lines_load_id ON log.load_lines USING btree (load_id)|f
log|load_lines|idx_log_load_lines_tenant_id|CREATE INDEX idx_log_load_lines_tenant_id ON log.load_lines USING btree (tenant_id)|f
log|load_lines|load_lines_load_id_line_number_key|CREATE UNIQUE INDEX load_lines_load_id_line_number_key ON log.load_lines USING btree (load_id, line_number)|t
log|load_stops|idx_log_load_stops_load_id|CREATE INDEX idx_log_load_stops_load_id ON log.load_stops USING btree (load_id)|f
log|load_stops|idx_log_load_stops_sequence|CREATE INDEX idx_log_load_stops_sequence ON log.load_stops USING btree (load_id, stop_sequence)|f
log|load_stops|idx_log_load_stops_status|CREATE INDEX idx_log_load_stops_status ON log.load_stops USING btree (status)|f
log|load_stops|idx_log_load_stops_tenant_id|CREATE INDEX idx_log_load_stops_tenant_id ON log.load_stops USING btree (tenant_id)|f
log|load_stops|idx_log_load_stops_type|CREATE INDEX idx_log_load_stops_type ON log.load_stops USING btree (stop_type)|f
log|load_stops|load_stops_load_id_stop_sequence_key|CREATE UNIQUE INDEX load_stops_load_id_stop_sequence_key ON log.load_stops USING btree (load_id, stop_sequence)|t
log|loads|idx_log_loads_carrier_id|CREATE INDEX idx_log_loads_carrier_id ON log.loads USING btree (carrier_id)|f
log|loads|idx_log_loads_driver_id|CREATE INDEX idx_log_loads_driver_id ON log.loads USING btree (driver_id)|f
log|loads|idx_log_loads_number|CREATE INDEX idx_log_loads_number ON log.loads USING btree (load_number)|f
log|loads|idx_log_loads_scheduled_start|CREATE INDEX idx_log_loads_scheduled_start ON log.loads USING btree (scheduled_start)|f
log|loads|idx_log_loads_shipment_id|CREATE INDEX idx_log_loads_shipment_id ON log.loads USING btree (shipment_id)|f
log|loads|idx_log_loads_status|CREATE INDEX idx_log_loads_status ON log.loads USING btree (status)|f
