admin|scheduled_tasks|scheduled_tasks_task_code_key|CREATE UNIQUE INDEX scheduled_tasks_task_code_key ON admin.scheduled_tasks USING btree (task_code)|t
admin|user_data_assignments|user_data_assignments_user_id_dimension_id_dimension_value__key|CREATE UNIQUE INDEX user_data_assignments_user_id_dimension_id_dimension_value__key ON admin.user_data_assignments USING btree (user_id, dimension_id, dimension_value_id)|t
admin|user_data_dimensions|user_data_dimensions_dimension_code_key|CREATE UNIQUE INDEX user_data_dimensions_dimension_code_key ON admin.user_data_dimensions USING btree (dimension_code)|t
admin|user_data_security_policies|user_data_security_policies_policy_code_key|CREATE UNIQUE INDEX user_data_security_policies_policy_code_key ON admin.user_data_security_policies USING btree (policy_code)|t
admin|user_duty_role_privileges|user_duty_role_privileges_duty_role_id_privilege_id_key|CREATE UNIQUE INDEX user_duty_role_privileges_duty_role_id_privilege_id_key ON admin.user_duty_role_privileges USING btree (duty_role_id, privilege_id)|t
admin|user_duty_roles|user_duty_roles_duty_role_code_key|CREATE UNIQUE INDEX user_duty_roles_duty_role_code_key ON admin.user_duty_roles USING btree (duty_role_code)|t
admin|user_job_role_assignments|user_job_role_assignments_user_id_job_role_id_key|CREATE UNIQUE INDEX user_job_role_assignments_user_id_job_role_id_key ON admin.user_job_role_assignments USING btree (user_id, job_role_id)|t
admin|user_job_role_duties|user_job_role_duties_job_role_id_duty_role_id_key|CREATE UNIQUE INDEX user_job_role_duties_job_role_id_duty_role_id_key ON admin.user_job_role_duties USING btree (job_role_id, duty_role_id)|t
admin|user_job_roles|user_job_roles_job_role_code_key|CREATE UNIQUE INDEX user_job_roles_job_role_code_key ON admin.user_job_roles USING btree (job_role_code)|t
admin|user_privileges|user_privileges_privilege_code_key|CREATE UNIQUE INDEX user_privileges_privilege_code_key ON admin.user_privileges USING btree (privilege_code)|t
ap|__drizzle_migrations|__drizzle_migrations_hash_key|CREATE UNIQUE INDEX __drizzle_migrations_hash_key ON ap.__drizzle_migrations USING btree (hash)|t
ap|aging_snapshots|idx_ap_aging_date|CREATE INDEX idx_ap_aging_date ON ap.aging_snapshots USING btree (snapshot_date)|f
ap|aging_snapshots|idx_ap_aging_partner|CREATE INDEX idx_ap_aging_partner ON ap.aging_snapshots USING btree (partner_id)|f
ap|ap_invoice_lines|idx_ap_inv_line_header|CREATE INDEX idx_ap_inv_line_header ON ap.ap_invoice_lines USING btree (ap_invoice_id)|f
ap|ap_invoice_lines|idx_ap_inv_line_item|CREATE INDEX idx_ap_inv_line_item ON ap.ap_invoice_lines USING btree (item_id)|f
ap|ap_invoice_lines|idx_ap_invoice_lines_invoice|CREATE INDEX idx_ap_invoice_lines_invoice ON ap.ap_invoice_lines USING btree (ap_invoice_id)|f
ap|ap_invoices|idx_ap_inv_date|CREATE INDEX idx_ap_inv_date ON ap.ap_invoices USING btree (invoice_date)|f
ap|ap_invoices|idx_ap_inv_due|CREATE INDEX idx_ap_inv_due ON ap.ap_invoices USING btree (invoice_due_date)|f
ap|ap_invoices|idx_ap_inv_paid|CREATE INDEX idx_ap_inv_paid ON ap.ap_invoices USING btree (is_paid)|f
ap|ap_invoices|idx_ap_inv_po|CREATE INDEX idx_ap_inv_po ON ap.ap_invoices USING btree (po_id)|f
ap|ap_invoices|idx_ap_inv_status|CREATE INDEX idx_ap_inv_status ON ap.ap_invoices USING btree (invoice_status)|f
ap|ap_invoices|idx_ap_inv_supplier|CREATE INDEX idx_ap_inv_supplier ON ap.ap_invoices USING btree (supplier_id)|f
ap|ap_invoices|idx_ap_invoices_date|CREATE INDEX idx_ap_invoices_date ON ap.ap_invoices USING btree (invoice_date)|f
ap|ap_invoices|idx_ap_invoices_status|CREATE INDEX idx_ap_invoices_status ON ap.ap_invoices USING btree (invoice_status)|f
ap|ap_invoices|idx_ap_invoices_supplier|CREATE INDEX idx_ap_invoices_supplier ON ap.ap_invoices USING btree (supplier_id)|f
ap|ap_invoices|uq_invoice_number|CREATE UNIQUE INDEX uq_invoice_number ON ap.ap_invoices USING btree (invoice_number)|t
ap|ap_supplier_sites|idx_ap_site_code|CREATE INDEX idx_ap_site_code ON ap.ap_supplier_sites USING btree (supplier_site_code)|f
ap|ap_supplier_sites|idx_ap_site_supplier|CREATE INDEX idx_ap_site_supplier ON ap.ap_supplier_sites USING btree (supplier_id)|f
ap|ap_suppliers|ap_suppliers_supplier_number_key|CREATE UNIQUE INDEX ap_suppliers_supplier_number_key ON ap.ap_suppliers USING btree (supplier_number)|t
ap|ap_suppliers|idx_ap_supplier_number|CREATE INDEX idx_ap_supplier_number ON ap.ap_suppliers USING btree (supplier_number)|f
ap|ap_suppliers|idx_ap_supplier_status|CREATE INDEX idx_ap_supplier_status ON ap.ap_suppliers USING btree (supplier_status)|f
ap|ap_suppliers|idx_ap_supplier_type|CREATE INDEX idx_ap_supplier_type ON ap.ap_suppliers USING btree (supplier_type)|f
ap|bank_accounts|idx_ap_bank_account|CREATE INDEX idx_ap_bank_account ON ap.bank_accounts USING btree (account_number)|f
ap|bank_statement_lines|idx_ap_stmt_line_stmt|CREATE INDEX idx_ap_stmt_line_stmt ON ap.bank_statement_lines USING btree (statement_id)|f
ap|bank_statements|idx_ap_stmt_account|CREATE INDEX idx_ap_stmt_account ON ap.bank_statements USING btree (bank_account_id)|f
ap|discount_tracking|idx_ap_disc_invoice|CREATE INDEX idx_ap_disc_invoice ON ap.discount_tracking USING btree (invoice_id)|f
ap|expense_report_lines|idx_ap_exp_line_report|CREATE INDEX idx_ap_exp_line_report ON ap.expense_report_lines USING btree (report_id)|f
ap|expense_reports|expense_reports_report_number_key|CREATE UNIQUE INDEX expense_reports_report_number_key ON ap.expense_reports USING btree (report_number)|t
ap|expense_reports|idx_ap_exp_report_status|CREATE INDEX idx_ap_exp_report_status ON ap.expense_reports USING btree (status)|f
ap|gl_mapping_rules|gl_mapping_rules_rule_code_key|CREATE UNIQUE INDEX gl_mapping_rules_rule_code_key ON ap.gl_mapping_rules USING btree (rule_code)|t
ap|import_interface|import_interface_source_transaction_id_key|CREATE UNIQUE INDEX import_interface_source_transaction_id_key ON ap.import_interface USING btree (source_transaction_id)|t
ap|invoice_distributions|idx_ap_dist_invoice|CREATE INDEX idx_ap_dist_invoice ON ap.invoice_distributions USING btree (invoice_id)|f
ap|invoice_holds|idx_ap_hold_invoice|CREATE INDEX idx_ap_hold_invoice ON ap.invoice_holds USING btree (invoice_id)|f
ap|invoice_holds|idx_ap_hold_status|CREATE INDEX idx_ap_hold_status ON ap.invoice_holds USING btree (status)|f
ap|match_exceptions|idx_ap_me_invoice|CREATE INDEX idx_ap_me_invoice ON ap.match_exceptions USING btree (invoice_id)|f
ap|match_exceptions|idx_ap_me_status|CREATE INDEX idx_ap_me_status ON ap.match_exceptions USING btree (status)|f
ap|matching_rules|idx_ap_mr_match_type|CREATE INDEX idx_ap_mr_match_type ON ap.matching_rules USING btree (match_type)|f
ap|matching_rules|matching_rules_rule_code_key|CREATE UNIQUE INDEX matching_rules_rule_code_key ON ap.matching_rules USING btree (rule_code)|t
ap|payment_batches|idx_ap_batch_status|CREATE INDEX idx_ap_batch_status ON ap.payment_batches USING btree (status)|f
ap|payment_batches|payment_batches_batch_number_key|CREATE UNIQUE INDEX payment_batches_batch_number_key ON ap.payment_batches USING btree (batch_number)|t
ap|payment_instructions|idx_ap_pay_batch|CREATE INDEX idx_ap_pay_batch ON ap.payment_instructions USING btree (batch_id)|f
ap|payment_instructions|idx_ap_pay_invoice|CREATE INDEX idx_ap_pay_invoice ON ap.payment_instructions USING btree (invoice_id)|f
ap|payment_instructions|idx_ap_pay_partner|CREATE INDEX idx_ap_pay_partner ON ap.payment_instructions USING btree (partner_id)|f
ap|payment_instructions|idx_ap_pay_status|CREATE INDEX idx_ap_pay_status ON ap.payment_instructions USING btree (status)|f
ap|payment_instructions|payment_instructions_payment_number_key|CREATE UNIQUE INDEX payment_instructions_payment_number_key ON ap.payment_instructions USING btree (payment_number)|t
ap|payment_methods|idx_ap_method_code|CREATE INDEX idx_ap_method_code ON ap.payment_methods USING btree (method_code)|f
ap|payment_methods|payment_methods_method_code_key|CREATE UNIQUE INDEX payment_methods_method_code_key ON ap.payment_methods USING btree (method_code)|t
ap|payment_terms|idx_ap_terms_code|CREATE INDEX idx_ap_terms_code ON ap.payment_terms USING btree (term_code)|f
ap|payment_terms|payment_terms_term_code_key|CREATE UNIQUE INDEX payment_terms_term_code_key ON ap.payment_terms USING btree (term_code)|t
ap|period_status|period_status_period_name_key|CREATE UNIQUE INDEX period_status_period_name_key ON ap.period_status USING btree (period_name)|t
ap|prepayments|prepayments_prepayment_number_key|CREATE UNIQUE INDEX prepayments_prepayment_number_key ON ap.prepayments USING btree (prepayment_number)|t
ap|tax_codes|idx_ap_tax_code|CREATE INDEX idx_ap_tax_code ON ap.tax_codes USING btree (tax_code)|f
ap|tax_codes|tax_codes_tax_code_key|CREATE UNIQUE INDEX tax_codes_tax_code_key ON ap.tax_codes USING btree (tax_code)|t
ap|withholding_tax|idx_ap_wht_code|CREATE INDEX idx_ap_wht_code ON ap.withholding_tax USING btree (wht_code)|f
ap|withholding_tax|withholding_tax_wht_code_key|CREATE UNIQUE INDEX withholding_tax_wht_code_key ON ap.withholding_tax USING btree (wht_code)|t
ap|workflow_definitions|workflow_definitions_workflow_code_key|CREATE UNIQUE INDEX workflow_definitions_workflow_code_key ON ap.workflow_definitions USING btree (workflow_code)|t
ar|__drizzle_migrations|__drizzle_migrations_hash_key|CREATE UNIQUE INDEX __drizzle_migrations_hash_key ON ar.__drizzle_migrations USING btree (hash)|t
ar|adjustments|idx_ar_adj_invoice|CREATE INDEX idx_ar_adj_invoice ON ar.adjustments USING btree (invoice_id)|f
ar|adjustments|idx_ar_adj_type|CREATE INDEX idx_ar_adj_type ON ar.adjustments USING btree (adjustment_type)|f
ar|aging_snapshots|idx_ar_aging_customer|CREATE INDEX idx_ar_aging_customer ON ar.aging_snapshots USING btree (customer_id)|f
ar|aging_snapshots|idx_ar_aging_date|CREATE INDEX idx_ar_aging_date ON ar.aging_snapshots USING btree (snapshot_date)|f
ar|ar_customer_locations|idx_ar_cust_loc_site|CREATE INDEX idx_ar_cust_loc_site ON ar.ar_customer_locations USING btree (cust_acct_site_id)|f
ar|ar_customer_locations|idx_ar_cust_loc_type|CREATE INDEX idx_ar_cust_loc_type ON ar.ar_customer_locations USING btree (location_type)|f
ar|ar_customer_sites|idx_ar_cust_site_cust|CREATE INDEX idx_ar_cust_site_cust ON ar.ar_customer_sites USING btree (cust_account_id)|f
ar|ar_customer_sites|idx_ar_customer_sites_customer|CREATE INDEX idx_ar_customer_sites_customer ON ar.ar_customer_sites USING btree (cust_account_id)|f
ar|ar_customers|idx_ar_cust_customer|CREATE INDEX idx_ar_cust_customer ON ar.ar_customers USING btree (partner_id)|f
ar|ar_customers|idx_ar_cust_number|CREATE INDEX idx_ar_cust_number ON ar.ar_customers USING btree (account_number)|f
ar|ar_customers|idx_ar_cust_partner|CREATE INDEX idx_ar_cust_partner ON ar.ar_customers USING btree (partner_id)|f
ar|ar_customers|idx_ar_cust_risk|CREATE INDEX idx_ar_cust_risk ON ar.ar_customers USING btree (risk_category)|f
ar|ar_customers|idx_ar_cust_status|CREATE INDEX idx_ar_cust_status ON ar.ar_customers USING btree (account_status) WHERE (is_active = true)|f
ar|ar_customers|idx_ar_customers_partner|CREATE INDEX idx_ar_customers_partner ON ar.ar_customers USING btree (partner_id)|f
ar|ar_customers|idx_ar_customers_status|CREATE INDEX idx_ar_customers_status ON ar.ar_customers USING btree (account_status)|f
ar|ar_customers|uq_customer_number|CREATE UNIQUE INDEX uq_customer_number ON ar.ar_customers USING btree (account_number)|t
ar|ar_invoice_lines|idx_ar_inv_line_header|CREATE INDEX idx_ar_inv_line_header ON ar.ar_invoice_lines USING btree (ar_invoice_id)|f
ar|ar_invoice_lines|idx_ar_inv_line_so|CREATE INDEX idx_ar_inv_line_so ON ar.ar_invoice_lines USING btree (so_line_id)|f
ar|ar_invoices|idx_ar_inv_customer|CREATE INDEX idx_ar_inv_customer ON ar.ar_invoices USING btree (customer_id)|f
ar|ar_invoices|idx_ar_inv_date|CREATE INDEX idx_ar_inv_date ON ar.ar_invoices USING btree (invoice_date)|f
ar|ar_invoices|idx_ar_inv_due|CREATE INDEX idx_ar_inv_due ON ar.ar_invoices USING btree (due_date)|f
ar|ar_invoices|idx_ar_inv_paid|CREATE INDEX idx_ar_inv_paid ON ar.ar_invoices USING btree (is_paid)|f
ar|ar_invoices|idx_ar_inv_so|CREATE INDEX idx_ar_inv_so ON ar.ar_invoices USING btree (so_id)|f
ar|ar_invoices|idx_ar_inv_status|CREATE INDEX idx_ar_inv_status ON ar.ar_invoices USING btree (invoice_status)|f
ar|cash_receipts|cash_receipts_receipt_number_key|CREATE UNIQUE INDEX cash_receipts_receipt_number_key ON ar.cash_receipts USING btree (receipt_number)|t
ar|cash_receipts|idx_ar_cr_customer|CREATE INDEX idx_ar_cr_customer ON ar.cash_receipts USING btree (customer_id)|f
ar|cash_receipts|idx_ar_cr_date|CREATE INDEX idx_ar_cr_date ON ar.cash_receipts USING btree (receipt_date)|f
ar|cash_receipts|idx_ar_cr_status|CREATE INDEX idx_ar_cr_status ON ar.cash_receipts USING btree (status)|f
ar|collection_tasks|idx_ar_ct_collector|CREATE INDEX idx_ar_ct_collector ON ar.collection_tasks USING btree (collector_id)|f
ar|collection_tasks|idx_ar_ct_customer|CREATE INDEX idx_ar_ct_customer ON ar.collection_tasks USING btree (customer_id)|f
ar|collection_tasks|idx_ar_ct_status|CREATE INDEX idx_ar_ct_status ON ar.collection_tasks USING btree (status)|f
ar|credit_holds|idx_ar_ch_customer|CREATE INDEX idx_ar_ch_customer ON ar.credit_holds USING btree (customer_id)|f
ar|credit_profiles|idx_ar_cp_customer|CREATE INDEX idx_ar_cp_customer ON ar.credit_profiles USING btree (customer_id)|f
ar|customer_deposits|customer_deposits_deposit_number_key|CREATE UNIQUE INDEX customer_deposits_deposit_number_key ON ar.customer_deposits USING btree (deposit_number)|t
ar|customer_deposits|idx_ar_cd_customer|CREATE INDEX idx_ar_cd_customer ON ar.customer_deposits USING btree (customer_id)|f
ar|deposit_applications|idx_ar_da_deposit|CREATE INDEX idx_ar_da_deposit ON ar.deposit_applications USING btree (deposit_id)|f
ar|dunning_history|idx_ar_dh_customer|CREATE INDEX idx_ar_dh_customer ON ar.dunning_history USING btree (customer_id)|f
ar|dunning_plans|dunning_plans_plan_code_key|CREATE UNIQUE INDEX dunning_plans_plan_code_key ON ar.dunning_plans USING btree (plan_code)|t
ar|dunning_plans|idx_ar_dp_customer|CREATE INDEX idx_ar_dp_customer ON ar.dunning_plans USING btree (plan_code)|f
ar|import_interface|import_interface_source_transaction_id_key|CREATE UNIQUE INDEX import_interface_source_transaction_id_key ON ar.import_interface USING btree (source_transaction_id)|t
ar|invoice_distributions|idx_ar_inv_dist|CREATE INDEX idx_ar_inv_dist ON ar.invoice_distributions USING btree (invoice_id)|f
ar|mv_ar_aging|idx_mv_ar_aging_bucket|CREATE INDEX idx_mv_ar_aging_bucket ON ar.mv_ar_aging USING btree (aging_bucket)|f
ar|mv_ar_aging|idx_mv_ar_aging_customer|CREATE INDEX idx_mv_ar_aging_customer ON ar.mv_ar_aging USING btree (customer_id)|f
ar|mv_ar_aging|idx_mv_ar_aging_pk|CREATE UNIQUE INDEX idx_mv_ar_aging_pk ON ar.mv_ar_aging USING btree (ar_invoice_id)|t
ar|payment_schedules|idx_ar_ps_invoice|CREATE INDEX idx_ar_ps_invoice ON ar.payment_schedules USING btree (invoice_id)|f
ar|payment_schedules|idx_ar_ps_status|CREATE INDEX idx_ar_ps_status ON ar.payment_schedules USING btree (status)|f
ar|period_status|period_status_period_name_key|CREATE UNIQUE INDEX period_status_period_name_key ON ar.period_status USING btree (period_name)|t
ar|receipt_applications|idx_ar_ra_invoice|CREATE INDEX idx_ar_ra_invoice ON ar.receipt_applications USING btree (invoice_id)|f
ar|receipt_applications|idx_ar_ra_receipt|CREATE INDEX idx_ar_ra_receipt ON ar.receipt_applications USING btree (receipt_id)|f
ar|receipt_batches|receipt_batches_batch_number_key|CREATE UNIQUE INDEX receipt_batches_batch_number_key ON ar.receipt_batches USING btree (batch_number)|t
ar|revenue_schedules|idx_ar_rs_invoice|CREATE INDEX idx_ar_rs_invoice ON ar.revenue_schedules USING btree (invoice_id)|f
ar|tax_codes|idx_ar_tax_code|CREATE INDEX idx_ar_tax_code ON ar.tax_codes USING btree (tax_code)|f
ar|tax_codes|tax_codes_tax_code_key|CREATE UNIQUE INDEX tax_codes_tax_code_key ON ar.tax_codes USING btree (tax_code)|t
ar|transaction_types|idx_ar_tt_code|CREATE INDEX idx_ar_tt_code ON ar.transaction_types USING btree (type_code)|f
ar|transaction_types|transaction_types_type_code_key|CREATE UNIQUE INDEX transaction_types_type_code_key ON ar.transaction_types USING btree (type_code)|t
ar|workflow_definitions|workflow_definitions_workflow_code_key|CREATE UNIQUE INDEX workflow_definitions_workflow_code_key ON ar.workflow_definitions USING btree (workflow_code)|t
collab|__drizzle_migrations|__drizzle_migrations_hash_key|CREATE UNIQUE INDEX __drizzle_migrations_hash_key ON collab.__drizzle_migrations USING btree (hash)|t
collab|activities|activities_assigned_to_idx|CREATE INDEX activities_assigned_to_idx ON collab.activities USING btree (assigned_to)|f
collab|activities|activities_due_date_idx|CREATE INDEX activities_due_date_idx ON collab.activities USING btree (due_date)|f
collab|activities|activities_due_date_idx1|CREATE INDEX activities_due_date_idx1 ON collab.activities USING btree (due_date)|f
collab|activities|activities_res_model_res_id_idx|CREATE INDEX activities_res_model_res_id_idx ON collab.activities USING btree (res_model, res_id)|f
collab|activities|activities_res_model_res_id_idx1|CREATE INDEX activities_res_model_res_id_idx1 ON collab.activities USING btree (res_model, res_id)|f
collab|activities|activities_res_model_res_id_idx2|CREATE INDEX activities_res_model_res_id_idx2 ON collab.activities USING btree (res_model, res_id)|f
collab|activities|activities_status_idx|CREATE INDEX activities_status_idx ON collab.activities USING btree (status)|f
collab|activities|activities_status_idx1|CREATE INDEX activities_status_idx1 ON collab.activities USING btree (status)|f
collab|calendar_events|calendar_events_event_date_idx|CREATE INDEX calendar_events_event_date_idx ON collab.calendar_events USING btree (event_date)|f
collab|calendar_events|calendar_events_event_type_idx|CREATE INDEX calendar_events_event_type_idx ON collab.calendar_events USING btree (event_type)|f
collab|channel_messages|channel_messages_channel_id_created_at_idx|CREATE INDEX channel_messages_channel_id_created_at_idx ON collab.channel_messages USING btree (channel_id, created_at)|f
collab|channels|channels_is_active_idx|CREATE INDEX channels_is_active_idx ON collab.channels USING btree (is_active)|f
collab|channels|channels_name_key|CREATE UNIQUE INDEX channels_name_key ON collab.channels USING btree (name)|t
collab|dm_messages|dm_messages_conversation_id_created_at_idx|CREATE INDEX dm_messages_conversation_id_created_at_idx ON collab.dm_messages USING btree (conversation_id, created_at)|f
collab|todos|todos_assigned_to_idx|CREATE INDEX todos_assigned_to_idx ON collab.todos USING btree (assigned_to)|f
collab|todos|todos_is_complete_idx|CREATE INDEX todos_is_complete_idx ON collab.todos USING btree (is_complete)|f
collab|todos|todos_is_complete_idx1|CREATE INDEX todos_is_complete_idx1 ON collab.todos USING btree (is_complete)|f
core|__drizzle_migrations|__drizzle_migrations_hash_key|CREATE UNIQUE INDEX __drizzle_migrations_hash_key ON core.__drizzle_migrations USING btree (hash)|t
core|addresses|idx_addresses_partner|CREATE INDEX idx_addresses_partner ON core.addresses USING btree (partner_id)|f
core|addresses|idx_addresses_partner_id|CREATE INDEX idx_addresses_partner_id ON core.addresses USING btree (partner_id)|f
core|addresses|idx_addresses_type|CREATE INDEX idx_addresses_type ON core.addresses USING btree (address_type)|f
core|addresses|idx_core_addr_country|CREATE INDEX idx_core_addr_country ON core.addresses USING btree (country)|f
core|addresses|idx_core_addr_partner|CREATE INDEX idx_core_addr_partner ON core.addresses USING btree (partner_id)|f
core|addresses|idx_core_addr_type|CREATE INDEX idx_core_addr_type ON core.addresses USING btree (address_type)|f
core|attachments|idx_core_attachments_entity|CREATE INDEX idx_core_attachments_entity ON core.attachments USING btree (entity_name, entity_id)|f
core|attachments|idx_core_attachments_type|CREATE INDEX idx_core_attachments_type ON core.attachments USING btree (attachment_type)|f
core|business_units|business_units_bu_code_key|CREATE UNIQUE INDEX business_units_bu_code_key ON core.business_units USING btree (bu_code)|t
core|business_units|idx_core_bu_company|CREATE INDEX idx_core_bu_company ON core.business_units USING btree (company_id)|f
core|companies|companies_company_code_key|CREATE UNIQUE INDEX companies_company_code_key ON core.companies USING btree (company_code)|t
core|companies|idx_companies_corporate|CREATE INDEX idx_companies_corporate ON core.companies USING btree (corporate_id)|f
core|companies|idx_core_comp_corporate|CREATE INDEX idx_core_comp_corporate ON core.companies USING btree (corporate_id)|f
core|event_store|idx_core_events_agg|CREATE INDEX idx_core_events_agg ON core.event_store USING btree (aggregate_type, aggregate_id, event_version)|f
core|event_store|idx_core_events_ts|CREATE INDEX idx_core_events_ts ON core.event_store USING btree ("timestamp")|f
core|event_store|idx_event_aggregate|CREATE INDEX idx_event_aggregate ON core.event_store USING btree (aggregate_type, aggregate_id, event_version)|f
core|event_store|idx_event_jsonb|CREATE INDEX idx_event_jsonb ON core.event_store USING gin (payload)|f
core|event_store|idx_event_store_aggregate|CREATE INDEX idx_event_store_aggregate ON core.event_store USING btree (aggregate_type, aggregate_id, event_version)|f
core|event_store|idx_event_store_jsonb|CREATE INDEX idx_event_store_jsonb ON core.event_store USING gin (payload)|f
core|locations|idx_core_loc_warehouse|CREATE INDEX idx_core_loc_warehouse ON core.locations USING btree (warehouse_id)|f
core|locations|idx_core_loc_zone|CREATE INDEX idx_core_loc_zone ON core.locations USING btree (zone_name)|f
core|locations|idx_locations_warehouse|CREATE INDEX idx_locations_warehouse ON core.locations USING btree (warehouse_id)|f
core|locations|uq_warehouse_location|CREATE UNIQUE INDEX uq_warehouse_location ON core.locations USING btree (warehouse_id, location_code)|t
core|objects|idx_objects_module|CREATE INDEX idx_objects_module ON core.objects USING btree (module)|f
core|objects|idx_objects_parent|CREATE INDEX idx_objects_parent ON core.objects USING btree (parent_object_id)|f
core|objects|idx_objects_type|CREATE INDEX idx_objects_type ON core.objects USING btree (object_type)|f
core|objects|objects_object_code_unique|CREATE UNIQUE INDEX objects_object_code_unique ON core.objects USING btree (object_code)|t
core|partner_bank_accounts|idx_partner_bank_accounts_partner|CREATE INDEX idx_partner_bank_accounts_partner ON core.partner_bank_accounts USING btree (partner_id)|f
core|partner_contacts|idx_partner_contacts_partner|CREATE INDEX idx_partner_contacts_partner ON core.partner_contacts USING btree (partner_id)|f
core|partner_groups|partner_groups_group_code_key|CREATE UNIQUE INDEX partner_groups_group_code_key ON core.partner_groups USING btree (group_code)|t
core|partner_sites|idx_core_ps_partner|CREATE INDEX idx_core_ps_partner ON core.partner_sites USING btree (partner_id)|f
core|partner_sites|idx_party_sites_partner|CREATE INDEX idx_party_sites_partner ON core.partner_sites USING btree (partner_id)|f
core|partners|idx_core_partners_code|CREATE INDEX idx_core_partners_code ON core.partners USING btree (partner_code)|f
core|partners|idx_core_partners_country|CREATE INDEX idx_core_partners_country ON core.partners USING btree (country_code)|f
core|partners|idx_core_partners_status|CREATE INDEX idx_core_partners_status ON core.partners USING btree (party_status) WHERE (is_active = true)|f
core|partners|idx_partners_country|CREATE INDEX idx_partners_country ON core.partners USING btree (country_code)|f
core|partners|idx_partners_credit_status|CREATE INDEX idx_partners_credit_status ON core.partners USING btree (credit_status)|f
core|partners|idx_partners_is_customer|CREATE INDEX idx_partners_is_customer ON core.partners USING btree (is_customer) WHERE (is_customer = true)|f
core|partners|idx_partners_is_employee|CREATE INDEX idx_partners_is_employee ON core.partners USING btree (is_employee) WHERE (is_employee = true)|f
core|partners|idx_partners_is_vendor|CREATE INDEX idx_partners_is_vendor ON core.partners USING btree (is_vendor) WHERE (is_vendor = true)|f
core|partners|idx_partners_partner_group|CREATE INDEX idx_partners_partner_group ON core.partners USING btree (partner_group_id)|f
core|partners|idx_partners_status|CREATE INDEX idx_partners_status ON core.partners USING btree (party_status) WHERE (is_active = true)|f
core|partners|partners_partner_code_key|CREATE UNIQUE INDEX partners_partner_code_key ON core.partners USING btree (partner_code)|t
core|permissions|idx_permissions_module|CREATE INDEX idx_permissions_module ON core.permissions USING btree (module)|f
core|permissions|permissions_permission_code_unique|CREATE UNIQUE INDEX permissions_permission_code_unique ON core.permissions USING btree (permission_code)|t
core|role_permissions|idx_role_permissions_permission_id|CREATE INDEX idx_role_permissions_permission_id ON core.role_permissions USING btree (permission_id)|f
core|role_permissions|idx_role_permissions_role_id|CREATE INDEX idx_role_permissions_role_id ON core.role_permissions USING btree (role_id)|f
core|roles|roles_role_code_unique|CREATE UNIQUE INDEX roles_role_code_unique ON core.roles USING btree (role_code)|t
core|sites|idx_core_sites_type|CREATE INDEX idx_core_sites_type ON core.sites USING btree (site_type)|f
core|sites|sites_site_code_key|CREATE UNIQUE INDEX sites_site_code_key ON core.sites USING btree (site_code)|t
core|system_config|system_config_config_key_key|CREATE UNIQUE INDEX system_config_config_key_key ON core.system_config USING btree (config_key)|t
core|tenants|tenants_tenant_code_key|CREATE UNIQUE INDEX tenants_tenant_code_key ON core.tenants USING btree (tenant_code)|t
core|user_org_assignments|idx_uo_assign_company|CREATE INDEX idx_uo_assign_company ON core.user_org_assignments USING btree (company_id)|f
