fa|fa_assets|idx_fa_assets_active_status|CREATE INDEX idx_fa_assets_active_status ON fa.fa_assets USING btree (asset_status_code) WHERE ((asset_status_code)::text = 'ACTIVE'::text)|f
fa|fa_assets|idx_fa_assets_barcode|CREATE INDEX idx_fa_assets_barcode ON fa.fa_assets USING btree (barcode) WHERE (barcode IS NOT NULL)|f
fa|fa_assets|idx_fa_assets_category|CREATE INDEX idx_fa_assets_category ON fa.fa_assets USING btree (asset_category_id)|f
fa|fa_assets|idx_fa_assets_composite_location_status|CREATE INDEX idx_fa_assets_composite_location_status ON fa.fa_assets USING btree (location_id, asset_status_code)|f
fa|fa_assets|idx_fa_assets_condition|CREATE INDEX idx_fa_assets_condition ON fa.fa_assets USING btree (condition_code)|f
fa|fa_assets|idx_fa_assets_custodian|CREATE INDEX idx_fa_assets_custodian ON fa.fa_assets USING btree (custodian_id)|f
fa|fa_assets|idx_fa_assets_location|CREATE INDEX idx_fa_assets_location ON fa.fa_assets USING btree (location_id)|f
fa|fa_assets|idx_fa_assets_number|CREATE INDEX idx_fa_assets_number ON fa.fa_assets USING btree (asset_number)|f
fa|fa_assets|idx_fa_assets_parent|CREATE INDEX idx_fa_assets_parent ON fa.fa_assets USING btree (parent_asset_id)|f
fa|fa_assets|idx_fa_assets_rfid|CREATE INDEX idx_fa_assets_rfid ON fa.fa_assets USING btree (rfid_tag) WHERE (rfid_tag IS NOT NULL)|f
fa|fa_assets|idx_fa_assets_search|CREATE INDEX idx_fa_assets_search ON fa.fa_assets USING gin (to_tsvector('english'::regconfig, (((COALESCE(asset_name, ''::character varying))::text || ' '::text) || (COALESCE(description, ''::character varying))::text)))|f
fa|fa_assets|idx_fa_assets_serial|CREATE INDEX idx_fa_assets_serial ON fa.fa_assets USING btree (serial_number)|f
fa|fa_assets|idx_fa_assets_source|CREATE INDEX idx_fa_assets_source ON fa.fa_assets USING btree (source_code)|f
fa|fa_assets|idx_fa_assets_status|CREATE INDEX idx_fa_assets_status ON fa.fa_assets USING btree (asset_status_code)|f
fa|fa_assets|idx_fa_assets_tenant_org|CREATE INDEX idx_fa_assets_tenant_org ON fa.fa_assets USING btree (tenant_id, organization_id)|f
fa|fa_assets|idx_fa_assets_type|CREATE INDEX idx_fa_assets_type ON fa.fa_assets USING btree (asset_type_id)|f
fa|fa_bonus_depreciation|idx_fa_bonus_deprn_asset|CREATE INDEX idx_fa_bonus_deprn_asset ON fa.fa_bonus_depreciation USING btree (asset_id)|f
fa|fa_bonus_depreciation|idx_fa_bonus_deprn_book|CREATE INDEX idx_fa_bonus_deprn_book ON fa.fa_bonus_depreciation USING btree (book_id)|f
fa|fa_bonus_depreciation|idx_fa_bonus_deprn_type|CREATE INDEX idx_fa_bonus_deprn_type ON fa.fa_bonus_depreciation USING btree (bonus_type_code)|f
fa|fa_bonus_depreciation|idx_fa_bonus_deprn_year|CREATE INDEX idx_fa_bonus_deprn_year ON fa.fa_bonus_depreciation USING btree (bonus_year)|f
fa|fa_book_types|fa_book_types_uk1|CREATE UNIQUE INDEX fa_book_types_uk1 ON fa.fa_book_types USING btree (book_type_code, tenant_id)|t
fa|fa_book_types|idx_fa_book_types_active|CREATE INDEX idx_fa_book_types_active ON fa.fa_book_types USING btree (is_active) WHERE ((is_active)::text = 'Y'::text)|f
fa|fa_book_types|idx_fa_book_types_code|CREATE INDEX idx_fa_book_types_code ON fa.fa_book_types USING btree (book_type_code)|f
fa|fa_cip_costs|idx_fa_cip_costs_date|CREATE INDEX idx_fa_cip_costs_date ON fa.fa_cip_costs USING btree (cost_date)|f
fa|fa_cip_costs|idx_fa_cip_costs_project|CREATE INDEX idx_fa_cip_costs_project ON fa.fa_cip_costs USING btree (cip_project_id)|f
fa|fa_cip_costs|idx_fa_cip_costs_type|CREATE INDEX idx_fa_cip_costs_type ON fa.fa_cip_costs USING btree (cost_type_code)|f
fa|fa_cip_projects|fa_cip_projects_uk1|CREATE UNIQUE INDEX fa_cip_projects_uk1 ON fa.fa_cip_projects USING btree (project_code, tenant_id)|t
fa|fa_cip_projects|idx_fa_cip_projects_active|CREATE INDEX idx_fa_cip_projects_active ON fa.fa_cip_projects USING btree (is_active) WHERE ((is_active)::text = 'Y'::text)|f
fa|fa_cip_projects|idx_fa_cip_projects_code|CREATE INDEX idx_fa_cip_projects_code ON fa.fa_cip_projects USING btree (project_code)|f
fa|fa_cip_projects|idx_fa_cip_projects_status|CREATE INDEX idx_fa_cip_projects_status ON fa.fa_cip_projects USING btree (cip_status_code)|f
fa|fa_cip_projects|idx_fa_cip_projects_target|CREATE INDEX idx_fa_cip_projects_target ON fa.fa_cip_projects USING btree (target_asset_id)|f
fa|fa_count_lines|fa_count_lines_uk1|CREATE UNIQUE INDEX fa_count_lines_uk1 ON fa.fa_count_lines USING btree (count_id, asset_id)|t
fa|fa_count_lines|idx_fa_count_lines_asset|CREATE INDEX idx_fa_count_lines_asset ON fa.fa_count_lines USING btree (asset_id)|f
fa|fa_count_lines|idx_fa_count_lines_count|CREATE INDEX idx_fa_count_lines_count ON fa.fa_count_lines USING btree (count_id)|f
fa|fa_count_lines|idx_fa_count_lines_expected_loc|CREATE INDEX idx_fa_count_lines_expected_loc ON fa.fa_count_lines USING btree (expected_location_id)|f
fa|fa_count_lines|idx_fa_count_lines_sheet|CREATE INDEX idx_fa_count_lines_sheet ON fa.fa_count_lines USING btree (sheet_id)|f
fa|fa_count_lines|idx_fa_count_lines_status|CREATE INDEX idx_fa_count_lines_status ON fa.fa_count_lines USING btree (line_status_code)|f
fa|fa_count_lines|idx_fa_count_lines_unscanned|CREATE INDEX idx_fa_count_lines_unscanned ON fa.fa_count_lines USING btree (is_scanned) WHERE ((is_scanned)::text = 'N'::text)|f
fa|fa_count_lines|idx_fa_count_lines_variance|CREATE INDEX idx_fa_count_lines_variance ON fa.fa_count_lines USING btree (variance_type_code)|f
fa|fa_count_routes|idx_fa_count_routes_counter|CREATE INDEX idx_fa_count_routes_counter ON fa.fa_count_routes USING btree (counter_id)|f
fa|fa_count_routes|idx_fa_count_routes_problem|CREATE INDEX idx_fa_count_routes_problem ON fa.fa_count_routes USING btree (problem_id)|f
fa|fa_count_routes|idx_fa_count_routes_sequence|CREATE INDEX idx_fa_count_routes_sequence ON fa.fa_count_routes USING gin (route_sequence)|f
fa|fa_count_sheets|fa_count_sheets_uk1|CREATE UNIQUE INDEX fa_count_sheets_uk1 ON fa.fa_count_sheets USING btree (count_id, sheet_number)|t
fa|fa_count_sheets|idx_fa_count_sheets_count|CREATE INDEX idx_fa_count_sheets_count ON fa.fa_count_sheets USING btree (count_id)|f
fa|fa_count_sheets|idx_fa_count_sheets_counter|CREATE INDEX idx_fa_count_sheets_counter ON fa.fa_count_sheets USING btree (counter_id)|f
fa|fa_count_sheets|idx_fa_count_sheets_status|CREATE INDEX idx_fa_count_sheets_status ON fa.fa_count_sheets USING btree (sheet_status_code)|f
fa|fa_count_variances|idx_fa_count_variances_asset|CREATE INDEX idx_fa_count_variances_asset ON fa.fa_count_variances USING btree (asset_id)|f
fa|fa_count_variances|idx_fa_count_variances_count|CREATE INDEX idx_fa_count_variances_count ON fa.fa_count_variances USING btree (count_id)|f
fa|fa_count_variances|idx_fa_count_variances_line|CREATE INDEX idx_fa_count_variances_line ON fa.fa_count_variances USING btree (count_line_id)|f
fa|fa_count_variances|idx_fa_count_variances_severity|CREATE INDEX idx_fa_count_variances_severity ON fa.fa_count_variances USING btree (variance_severity_code)|f
fa|fa_count_variances|idx_fa_count_variances_type|CREATE INDEX idx_fa_count_variances_type ON fa.fa_count_variances USING btree (variance_type_code)|f
fa|fa_custodians|fa_custodians_uk1|CREATE UNIQUE INDEX fa_custodians_uk1 ON fa.fa_custodians USING btree (custodian_code, tenant_id)|t
fa|fa_custodians|idx_fa_custodians_active|CREATE INDEX idx_fa_custodians_active ON fa.fa_custodians USING btree (is_active) WHERE ((is_active)::text = 'Y'::text)|f
fa|fa_custodians|idx_fa_custodians_code|CREATE INDEX idx_fa_custodians_code ON fa.fa_custodians USING btree (custodian_code)|f
fa|fa_custodians|idx_fa_custodians_dept|CREATE INDEX idx_fa_custodians_dept ON fa.fa_custodians USING btree (department_code)|f
fa|fa_custodians|idx_fa_custodians_employee|CREATE INDEX idx_fa_custodians_employee ON fa.fa_custodians USING btree (employee_id)|f
fa|fa_custodians|idx_fa_custodians_type|CREATE INDEX idx_fa_custodians_type ON fa.fa_custodians USING btree (custodian_type_code)|f
fa|fa_deprn_book_periods|fa_deprn_book_periods_uk1|CREATE UNIQUE INDEX fa_deprn_book_periods_uk1 ON fa.fa_deprn_book_periods USING btree (book_id, period_name, fiscal_year)|t
fa|fa_deprn_book_periods|idx_fa_deprn_book_periods_book|CREATE INDEX idx_fa_deprn_book_periods_book ON fa.fa_deprn_book_periods USING btree (book_id)|f
fa|fa_deprn_book_periods|idx_fa_deprn_book_periods_dates|CREATE INDEX idx_fa_deprn_book_periods_dates ON fa.fa_deprn_book_periods USING btree (start_date, end_date)|f
fa|fa_deprn_book_periods|idx_fa_deprn_book_periods_open|CREATE INDEX idx_fa_deprn_book_periods_open ON fa.fa_deprn_book_periods USING btree (period_status_code) WHERE ((period_status_code)::text = 'OPEN'::text)|f
fa|fa_deprn_book_periods|idx_fa_deprn_book_periods_status|CREATE INDEX idx_fa_deprn_book_periods_status ON fa.fa_deprn_book_periods USING btree (period_status_code)|f
fa|fa_deprn_book_periods|idx_fa_deprn_book_periods_year|CREATE INDEX idx_fa_deprn_book_periods_year ON fa.fa_deprn_book_periods USING btree (fiscal_year)|f
fa|fa_deprn_books|fa_deprn_books_uk1|CREATE UNIQUE INDEX fa_deprn_books_uk1 ON fa.fa_deprn_books USING btree (book_code, tenant_id)|t
fa|fa_deprn_books|idx_fa_deprn_books_active|CREATE INDEX idx_fa_deprn_books_active ON fa.fa_deprn_books USING btree (is_active) WHERE ((is_active)::text = 'Y'::text)|f
fa|fa_deprn_books|idx_fa_deprn_books_code|CREATE INDEX idx_fa_deprn_books_code ON fa.fa_deprn_books USING btree (book_code)|f
fa|fa_deprn_books|idx_fa_deprn_books_status|CREATE INDEX idx_fa_deprn_books_status ON fa.fa_deprn_books USING btree (book_status_code)|f
fa|fa_deprn_books|idx_fa_deprn_books_type|CREATE INDEX idx_fa_deprn_books_type ON fa.fa_deprn_books USING btree (book_type_id)|f
fa|fa_deprn_calculation|fa_deprn_calculation_uk1|CREATE UNIQUE INDEX fa_deprn_calculation_uk1 ON fa.fa_deprn_calculation USING btree (asset_id, book_id, period_id)|t
fa|fa_deprn_calculation|idx_fa_deprn_calc_asset|CREATE INDEX idx_fa_deprn_calc_asset ON fa.fa_deprn_calculation USING btree (asset_id)|f
fa|fa_deprn_calculation|idx_fa_deprn_calc_asset_book|CREATE INDEX idx_fa_deprn_calc_asset_book ON fa.fa_deprn_calculation USING btree (asset_id, book_id)|f
fa|fa_deprn_calculation|idx_fa_deprn_calc_asset_period|CREATE INDEX idx_fa_deprn_calc_asset_period ON fa.fa_deprn_calculation USING btree (asset_id, period_id)|f
fa|fa_deprn_calculation|idx_fa_deprn_calc_book|CREATE INDEX idx_fa_deprn_calc_book ON fa.fa_deprn_calculation USING btree (book_id)|f
fa|fa_deprn_calculation|idx_fa_deprn_calc_period|CREATE INDEX idx_fa_deprn_calc_period ON fa.fa_deprn_calculation USING btree (period_id)|f
fa|fa_deprn_calculation|idx_fa_deprn_calc_run|CREATE INDEX idx_fa_deprn_calc_run ON fa.fa_deprn_calculation USING btree (deprn_run_id)|f
fa|fa_deprn_calculation|idx_fa_deprn_calc_status|CREATE INDEX idx_fa_deprn_calc_status ON fa.fa_deprn_calculation USING btree (deprn_status_code)|f
fa|fa_deprn_calculation|idx_fa_deprn_calc_unposted|CREATE INDEX idx_fa_deprn_calc_unposted ON fa.fa_deprn_calculation USING btree (deprn_status_code) WHERE ((deprn_status_code)::text = 'CALCULATED'::text)|f
fa|fa_deprn_conventions|fa_deprn_conventions_uk1|CREATE UNIQUE INDEX fa_deprn_conventions_uk1 ON fa.fa_deprn_conventions USING btree (convention_code, tenant_id)|t
fa|fa_deprn_conventions|idx_fa_deprn_conventions_active|CREATE INDEX idx_fa_deprn_conventions_active ON fa.fa_deprn_conventions USING btree (is_active) WHERE ((is_active)::text = 'Y'::text)|f
fa|fa_deprn_conventions|idx_fa_deprn_conventions_code|CREATE INDEX idx_fa_deprn_conventions_code ON fa.fa_deprn_conventions USING btree (convention_code)|f
fa|fa_deprn_methods|fa_deprn_methods_uk1|CREATE UNIQUE INDEX fa_deprn_methods_uk1 ON fa.fa_deprn_methods USING btree (method_code, tenant_id)|t
fa|fa_deprn_methods|idx_fa_deprn_methods_active|CREATE INDEX idx_fa_deprn_methods_active ON fa.fa_deprn_methods USING btree (is_active) WHERE ((is_active)::text = 'Y'::text)|f
fa|fa_deprn_methods|idx_fa_deprn_methods_code|CREATE INDEX idx_fa_deprn_methods_code ON fa.fa_deprn_methods USING btree (method_code)|f
fa|fa_deprn_methods|idx_fa_deprn_methods_type|CREATE INDEX idx_fa_deprn_methods_type ON fa.fa_deprn_methods USING btree (method_type_code)|f
fa|fa_group_asset_members|fa_group_asset_members_uk1|CREATE UNIQUE INDEX fa_group_asset_members_uk1 ON fa.fa_group_asset_members USING btree (group_id, asset_id)|t
fa|fa_group_asset_members|idx_fa_group_asset_members_asset|CREATE INDEX idx_fa_group_asset_members_asset ON fa.fa_group_asset_members USING btree (asset_id)|f
fa|fa_group_asset_members|idx_fa_group_asset_members_group|CREATE INDEX idx_fa_group_asset_members_group ON fa.fa_group_asset_members USING btree (group_id)|f
fa|fa_group_assets|fa_group_assets_uk1|CREATE UNIQUE INDEX fa_group_assets_uk1 ON fa.fa_group_assets USING btree (group_code, tenant_id)|t
fa|fa_group_assets|idx_fa_group_assets_code|CREATE INDEX idx_fa_group_assets_code ON fa.fa_group_assets USING btree (group_code)|f
fa|fa_group_assets|idx_fa_group_assets_status|CREATE INDEX idx_fa_group_assets_status ON fa.fa_group_assets USING btree (group_status_code)|f
fa|fa_group_assets|idx_fa_group_assets_type|CREATE INDEX idx_fa_group_assets_type ON fa.fa_group_assets USING btree (group_type_code)|f
fa|fa_impairments|idx_fa_impairments_asset|CREATE INDEX idx_fa_impairments_asset ON fa.fa_impairments USING btree (asset_id)|f
fa|fa_impairments|idx_fa_impairments_book|CREATE INDEX idx_fa_impairments_book ON fa.fa_impairments USING btree (book_id)|f
fa|fa_impairments|idx_fa_impairments_transaction|CREATE INDEX idx_fa_impairments_transaction ON fa.fa_impairments USING btree (transaction_id)|f
fa|fa_insurance_claims|fa_insurance_claims_uk1|CREATE UNIQUE INDEX fa_insurance_claims_uk1 ON fa.fa_insurance_claims USING btree (claim_number, tenant_id)|t
fa|fa_insurance_claims|idx_fa_insurance_claims_asset|CREATE INDEX idx_fa_insurance_claims_asset ON fa.fa_insurance_claims USING btree (asset_id)|f
fa|fa_insurance_claims|idx_fa_insurance_claims_policy|CREATE INDEX idx_fa_insurance_claims_policy ON fa.fa_insurance_claims USING btree (policy_id)|f
fa|fa_insurance_claims|idx_fa_insurance_claims_status|CREATE INDEX idx_fa_insurance_claims_status ON fa.fa_insurance_claims USING btree (claim_status_code)|f
fa|fa_insurance_policies|fa_insurance_policies_uk1|CREATE UNIQUE INDEX fa_insurance_policies_uk1 ON fa.fa_insurance_policies USING btree (policy_number, tenant_id)|t
fa|fa_insurance_policies|idx_fa_insurance_policies_active|CREATE INDEX idx_fa_insurance_policies_active ON fa.fa_insurance_policies USING btree (is_active) WHERE ((is_active)::text = 'Y'::text)|f
fa|fa_insurance_policies|idx_fa_insurance_policies_expiring|CREATE INDEX idx_fa_insurance_policies_expiring ON fa.fa_insurance_policies USING btree (expiration_date) WHERE ((policy_status_code)::text = 'ACTIVE'::text)|f
fa|fa_insurance_policies|idx_fa_insurance_policies_number|CREATE INDEX idx_fa_insurance_policies_number ON fa.fa_insurance_policies USING btree (policy_number)|f
fa|fa_insurance_policies|idx_fa_insurance_policies_status|CREATE INDEX idx_fa_insurance_policies_status ON fa.fa_insurance_policies USING btree (policy_status_code)|f
fa|fa_insurance_policies|idx_fa_insurance_policies_type|CREATE INDEX idx_fa_insurance_policies_type ON fa.fa_insurance_policies USING btree (coverage_type_code)|f
fa|fa_integration_connections|fa_integration_connections_uk1|CREATE UNIQUE INDEX fa_integration_connections_uk1 ON fa.fa_integration_connections USING btree (connection_name, tenant_id)|t
fa|fa_integration_connections|idx_fa_int_connections_active|CREATE INDEX idx_fa_int_connections_active ON fa.fa_integration_connections USING btree (is_active) WHERE ((is_active)::text = 'Y'::text)|f
fa|fa_integration_connections|idx_fa_int_connections_system|CREATE INDEX idx_fa_int_connections_system ON fa.fa_integration_connections USING btree (system_code)|f
fa|fa_integration_connections|idx_fa_int_connections_type|CREATE INDEX idx_fa_int_connections_type ON fa.fa_integration_connections USING btree (integration_type_code)|f
fa|fa_integration_logs|idx_fa_int_logs_connection|CREATE INDEX idx_fa_int_logs_connection ON fa.fa_integration_logs USING btree (connection_id)|f
fa|fa_integration_logs|idx_fa_int_logs_correlation|CREATE INDEX idx_fa_int_logs_correlation ON fa.fa_integration_logs USING btree (correlation_id)|f
fa|fa_integration_logs|idx_fa_int_logs_direction|CREATE INDEX idx_fa_int_logs_direction ON fa.fa_integration_logs USING btree (integration_direction)|f
fa|fa_integration_logs|idx_fa_int_logs_status|CREATE INDEX idx_fa_int_logs_status ON fa.fa_integration_logs USING btree (status_code)|f
fa|fa_integration_logs|idx_fa_int_logs_timestamp|CREATE INDEX idx_fa_int_logs_timestamp ON fa.fa_integration_logs USING btree (processed_timestamp)|f
fa|fa_langgraph_executions|idx_fa_langgraph_exec_started|CREATE INDEX idx_fa_langgraph_exec_started ON fa.fa_langgraph_executions USING btree (started_at)|f
fa|fa_langgraph_executions|idx_fa_langgraph_exec_state|CREATE INDEX idx_fa_langgraph_exec_state ON fa.fa_langgraph_executions USING gin (current_state)|f
fa|fa_langgraph_executions|idx_fa_langgraph_exec_status|CREATE INDEX idx_fa_langgraph_exec_status ON fa.fa_langgraph_executions USING btree (execution_status_code)|f
fa|fa_langgraph_executions|idx_fa_langgraph_exec_workflow|CREATE INDEX idx_fa_langgraph_exec_workflow ON fa.fa_langgraph_executions USING btree (workflow_id)|f
fa|fa_langgraph_states|idx_fa_langgraph_states_data|CREATE INDEX idx_fa_langgraph_states_data ON fa.fa_langgraph_states USING gin (state_data)|f
fa|fa_langgraph_states|idx_fa_langgraph_states_exec|CREATE INDEX idx_fa_langgraph_states_exec ON fa.fa_langgraph_states USING btree (execution_id)|f
fa|fa_langgraph_states|idx_fa_langgraph_states_node|CREATE INDEX idx_fa_langgraph_states_node ON fa.fa_langgraph_states USING btree (node_id)|f
fa|fa_langgraph_states|idx_fa_langgraph_states_status|CREATE INDEX idx_fa_langgraph_states_status ON fa.fa_langgraph_states USING btree (node_status_code)|f
fa|fa_langgraph_workflows|idx_fa_langgraph_workflows_active|CREATE INDEX idx_fa_langgraph_workflows_active ON fa.fa_langgraph_workflows USING btree (is_active) WHERE ((is_active)::text = 'Y'::text)|f
fa|fa_langgraph_workflows|idx_fa_langgraph_workflows_dag|CREATE INDEX idx_fa_langgraph_workflows_dag ON fa.fa_langgraph_workflows USING gin (dag_definition)|f
fa|fa_langgraph_workflows|idx_fa_langgraph_workflows_schema|CREATE INDEX idx_fa_langgraph_workflows_schema ON fa.fa_langgraph_workflows USING gin (state_schema)|f
fa|fa_langgraph_workflows|idx_fa_langgraph_workflows_status|CREATE INDEX idx_fa_langgraph_workflows_status ON fa.fa_langgraph_workflows USING btree (workflow_status_code)|f
fa|fa_lease_assets|fa_lease_assets_uk1|CREATE UNIQUE INDEX fa_lease_assets_uk1 ON fa.fa_lease_assets USING btree (lease_id, asset_id)|t
fa|fa_lease_assets|idx_fa_lease_assets_asset|CREATE INDEX idx_fa_lease_assets_asset ON fa.fa_lease_assets USING btree (asset_id)|f
fa|fa_lease_assets|idx_fa_lease_assets_lease|CREATE INDEX idx_fa_lease_assets_lease ON fa.fa_lease_assets USING btree (lease_id)|f
fa|fa_lease_schedules|fa_lease_schedules_uk1|CREATE UNIQUE INDEX fa_lease_schedules_uk1 ON fa.fa_lease_schedules USING btree (lease_id, payment_num)|t
fa|fa_lease_schedules|idx_fa_lease_schedules_date|CREATE INDEX idx_fa_lease_schedules_date ON fa.fa_lease_schedules USING btree (payment_date)|f
fa|fa_lease_schedules|idx_fa_lease_schedules_lease|CREATE INDEX idx_fa_lease_schedules_lease ON fa.fa_lease_schedules USING btree (lease_id)|f
fa|fa_lease_schedules|idx_fa_lease_schedules_status|CREATE INDEX idx_fa_lease_schedules_status ON fa.fa_lease_schedules USING btree (payment_status_code)|f
fa|fa_leases|fa_leases_uk1|CREATE UNIQUE INDEX fa_leases_uk1 ON fa.fa_leases USING btree (lease_number, tenant_id)|t
fa|fa_leases|idx_fa_leases_active|CREATE INDEX idx_fa_leases_active ON fa.fa_leases USING btree (is_active) WHERE ((is_active)::text = 'Y'::text)|f
fa|fa_leases|idx_fa_leases_end_date|CREATE INDEX idx_fa_leases_end_date ON fa.fa_leases USING btree (lease_end_date) WHERE ((lease_status_code)::text = 'ACTIVE'::text)|f
fa|fa_leases|idx_fa_leases_number|CREATE INDEX idx_fa_leases_number ON fa.fa_leases USING btree (lease_number)|f
fa|fa_leases|idx_fa_leases_status|CREATE INDEX idx_fa_leases_status ON fa.fa_leases USING btree (lease_status_code)|f
fa|fa_leases|idx_fa_leases_type|CREATE INDEX idx_fa_leases_type ON fa.fa_leases USING btree (lease_type_code)|f
fa|fa_llm_configs|fa_llm_configs_uk1|CREATE UNIQUE INDEX fa_llm_configs_uk1 ON fa.fa_llm_configs USING btree (config_name, tenant_id)|t
fa|fa_llm_configs|idx_fa_llm_configs_active|CREATE INDEX idx_fa_llm_configs_active ON fa.fa_llm_configs USING btree (is_active) WHERE ((is_active)::text = 'Y'::text)|f
fa|fa_llm_configs|idx_fa_llm_configs_name|CREATE INDEX idx_fa_llm_configs_name ON fa.fa_llm_configs USING btree (config_name)|f
fa|fa_llm_configs|idx_fa_llm_configs_provider|CREATE INDEX idx_fa_llm_configs_provider ON fa.fa_llm_configs USING btree (provider_name)|f
fa|fa_locations|fa_locations_uk1|CREATE UNIQUE INDEX fa_locations_uk1 ON fa.fa_locations USING btree (location_code, tenant_id)|t
fa|fa_locations|idx_fa_locations_active|CREATE INDEX idx_fa_locations_active ON fa.fa_locations USING btree (is_active) WHERE ((is_active)::text = 'Y'::text)|f
fa|fa_locations|idx_fa_locations_city|CREATE INDEX idx_fa_locations_city ON fa.fa_locations USING btree (city)|f
fa|fa_locations|idx_fa_locations_code|CREATE INDEX idx_fa_locations_code ON fa.fa_locations USING btree (location_code)|f
fa|fa_locations|idx_fa_locations_env_jsonb|CREATE INDEX idx_fa_locations_env_jsonb ON fa.fa_locations USING gin (environmental_controls)|f
fa|fa_locations|idx_fa_locations_parent|CREATE INDEX idx_fa_locations_parent ON fa.fa_locations USING btree (parent_location_id)|f
fa|fa_locations|idx_fa_locations_type|CREATE INDEX idx_fa_locations_type ON fa.fa_locations USING btree (location_type_code)|f
fa|fa_ml_models|idx_fa_ml_models_active|CREATE INDEX idx_fa_ml_models_active ON fa.fa_ml_models USING btree (is_active) WHERE ((is_active)::text = 'Y'::text)|f
fa|fa_ml_models|idx_fa_ml_models_framework|CREATE INDEX idx_fa_ml_models_framework ON fa.fa_ml_models USING btree (model_framework)|f
fa|fa_ml_models|idx_fa_ml_models_status|CREATE INDEX idx_fa_ml_models_status ON fa.fa_ml_models USING btree (model_status_code)|f
fa|fa_ml_models|idx_fa_ml_models_type|CREATE INDEX idx_fa_ml_models_type ON fa.fa_ml_models USING btree (model_type_code)|f
fa|fa_mobile_devices|fa_mobile_devices_uk1|CREATE UNIQUE INDEX fa_mobile_devices_uk1 ON fa.fa_mobile_devices USING btree (device_serial, tenant_id)|t
fa|fa_mobile_devices|idx_fa_mobile_devices_assigned|CREATE INDEX idx_fa_mobile_devices_assigned ON fa.fa_mobile_devices USING btree (assigned_to)|f
fa|fa_mobile_devices|idx_fa_mobile_devices_serial|CREATE INDEX idx_fa_mobile_devices_serial ON fa.fa_mobile_devices USING btree (device_serial)|f
fa|fa_mobile_devices|idx_fa_mobile_devices_status|CREATE INDEX idx_fa_mobile_devices_status ON fa.fa_mobile_devices USING btree (device_status_code)|f
fa|fa_mobile_devices|idx_fa_mobile_devices_type|CREATE INDEX idx_fa_mobile_devices_type ON fa.fa_mobile_devices USING btree (device_type_code)|f
fa|fa_mobile_scans|idx_fa_mobile_scans_asset|CREATE INDEX idx_fa_mobile_scans_asset ON fa.fa_mobile_scans USING btree (asset_id)|f
fa|fa_mobile_scans|idx_fa_mobile_scans_batch|CREATE INDEX idx_fa_mobile_scans_batch ON fa.fa_mobile_scans USING btree (batch_id)|f
fa|fa_mobile_scans|idx_fa_mobile_scans_count|CREATE INDEX idx_fa_mobile_scans_count ON fa.fa_mobile_scans USING btree (count_id)|f
fa|fa_mobile_scans|idx_fa_mobile_scans_counter|CREATE INDEX idx_fa_mobile_scans_counter ON fa.fa_mobile_scans USING btree (counter_id)|f
fa|fa_mobile_scans|idx_fa_mobile_scans_pending|CREATE INDEX idx_fa_mobile_scans_pending ON fa.fa_mobile_scans USING btree (sync_status_code) WHERE ((sync_status_code)::text = ANY ((ARRAY['PENDING'::character varying, 'FAILED'::character varying])::text[]))|f
fa|fa_mobile_scans|idx_fa_mobile_scans_source|CREATE INDEX idx_fa_mobile_scans_source ON fa.fa_mobile_scans USING btree (source_scan_id)|f
fa|fa_mobile_scans|idx_fa_mobile_scans_status|CREATE INDEX idx_fa_mobile_scans_status ON fa.fa_mobile_scans USING btree (scan_status_code)|f
fa|fa_mobile_scans|idx_fa_mobile_scans_sync|CREATE INDEX idx_fa_mobile_scans_sync ON fa.fa_mobile_scans USING btree (sync_status_code)|f
fa|fa_mobile_scans|idx_fa_mobile_scans_timestamp|CREATE INDEX idx_fa_mobile_scans_timestamp ON fa.fa_mobile_scans USING btree (scan_timestamp DESC)|f
fa|fa_mobile_sync_batches|idx_fa_mobile_sync_batches_device|CREATE INDEX idx_fa_mobile_sync_batches_device ON fa.fa_mobile_sync_batches USING btree (device_id)|f
fa|fa_mobile_sync_batches|idx_fa_mobile_sync_batches_status|CREATE INDEX idx_fa_mobile_sync_batches_status ON fa.fa_mobile_sync_batches USING btree (batch_status_code)|f
fa|fa_mobile_sync_batches|idx_fa_mobile_sync_batches_user|CREATE INDEX idx_fa_mobile_sync_batches_user ON fa.fa_mobile_sync_batches USING btree (mobile_user_id)|f
fa|fa_mobile_users|fa_mobile_users_uk1|CREATE UNIQUE INDEX fa_mobile_users_uk1 ON fa.fa_mobile_users USING btree (username, tenant_id)|t
fa|fa_mobile_users|idx_fa_mobile_users_custodian|CREATE INDEX idx_fa_mobile_users_custodian ON fa.fa_mobile_users USING btree (custodian_id)|f
fa|fa_mobile_users|idx_fa_mobile_users_role|CREATE INDEX idx_fa_mobile_users_role ON fa.fa_mobile_users USING btree (role_code)|f
fa|fa_mobile_users|idx_fa_mobile_users_username|CREATE INDEX idx_fa_mobile_users_username ON fa.fa_mobile_users USING btree (username)|f
fa|fa_optimization_problems|idx_fa_opt_problems_active|CREATE INDEX idx_fa_opt_problems_active ON fa.fa_optimization_problems USING btree (is_active) WHERE ((is_active)::text = 'Y'::text)|f
fa|fa_optimization_problems|idx_fa_opt_problems_constraints|CREATE INDEX idx_fa_opt_problems_constraints ON fa.fa_optimization_problems USING gin (constraints)|f
