om|workflow_definitions|workflow_definitions_workflow_code_key|CREATE UNIQUE INDEX workflow_definitions_workflow_code_key ON om.workflow_definitions USING btree (workflow_code)|t
om|workflow_tasks|idx_om_wf_order|CREATE INDEX idx_om_wf_order ON om.workflow_tasks USING btree (order_id, status)|f
om|workflow_tasks|idx_wf_tasks_order|CREATE INDEX idx_wf_tasks_order ON om.workflow_tasks USING btree (order_id, status)|f
po|__drizzle_migrations|__drizzle_migrations_hash_key|CREATE UNIQUE INDEX __drizzle_migrations_hash_key ON po.__drizzle_migrations USING btree (hash)|t
po|ai_workflow_state|idx_pm_ai_doc|CREATE INDEX idx_pm_ai_doc ON po.ai_workflow_state USING btree (doc_type, doc_id)|f
po|approval_hierarchies|approval_hierarchies_hierarchy_code_key|CREATE UNIQUE INDEX approval_hierarchies_hierarchy_code_key ON po.approval_hierarchies USING btree (hierarchy_code)|t
po|approval_hierarchies|idx_pm_aprv_hier_approver|CREATE INDEX idx_pm_aprv_hier_approver ON po.approval_hierarchies USING btree (approver_id)|f
po|approval_hierarchies|idx_pm_aprv_hier_code|CREATE INDEX idx_pm_aprv_hier_code ON po.approval_hierarchies USING btree (hierarchy_code)|f
po|approval_history|idx_aprv_doc|CREATE INDEX idx_aprv_doc ON po.approval_history USING btree (source_doc_type, source_doc_id)|f
po|approval_history|idx_pm_aprv_hist_approver|CREATE INDEX idx_pm_aprv_hist_approver ON po.approval_history USING btree (approver_id)|f
po|approval_history|idx_pm_aprv_hist_doc|CREATE INDEX idx_pm_aprv_hist_doc ON po.approval_history USING btree (source_doc_type, source_doc_id)|f
po|import_interface|idx_pm_import_status|CREATE INDEX idx_pm_import_status ON po.import_interface USING btree (status)|f
po|import_interface|import_interface_source_transaction_id_key|CREATE UNIQUE INDEX import_interface_source_transaction_id_key ON po.import_interface USING btree (source_transaction_id)|t
po|invoice_lines|idx_pm_il_invoice|CREATE INDEX idx_pm_il_invoice ON po.invoice_lines USING btree (invoice_id)|f
po|invoice_lines|idx_pm_il_po_line|CREATE INDEX idx_pm_il_po_line ON po.invoice_lines USING btree (po_line_id)|f
po|invoices|idx_pm_inv_partner|CREATE INDEX idx_pm_inv_partner ON po.invoices USING btree (partner_id)|f
po|invoices|idx_pm_inv_po|CREATE INDEX idx_pm_inv_po ON po.invoices USING btree (po_id)|f
po|invoices|idx_pm_inv_status|CREATE INDEX idx_pm_inv_status ON po.invoices USING btree (status)|f
po|invoices|invoices_invoice_number_key|CREATE UNIQUE INDEX invoices_invoice_number_key ON po.invoices USING btree (invoice_number)|t
po|match_exceptions|idx_pm_me_invoice|CREATE INDEX idx_pm_me_invoice ON po.match_exceptions USING btree (invoice_line_id)|f
po|match_exceptions|idx_pm_me_status|CREATE INDEX idx_pm_me_status ON po.match_exceptions USING btree (status)|f
po|po_amendments|idx_pm_poa_po|CREATE INDEX idx_pm_poa_po ON po.po_amendments USING btree (po_id)|f
po|po_distributions|idx_pm_pod_account|CREATE INDEX idx_pm_pod_account ON po.po_distributions USING btree (account_id)|f
po|po_distributions|idx_pm_pod_po|CREATE INDEX idx_pm_pod_po ON po.po_distributions USING btree (po_id)|f
po|po_headers|idx_po_hdr_buyer|CREATE INDEX idx_po_hdr_buyer ON po.po_headers USING btree (buyer_id)|f
po|po_headers|idx_po_hdr_date|CREATE INDEX idx_po_hdr_date ON po.po_headers USING btree (order_date)|f
po|po_headers|idx_po_hdr_po_number|CREATE INDEX idx_po_hdr_po_number ON po.po_headers USING btree (po_number)|f
po|po_headers|idx_po_hdr_status|CREATE INDEX idx_po_hdr_status ON po.po_headers USING btree (status)|f
po|po_headers|idx_po_hdr_supplier|CREATE INDEX idx_po_hdr_supplier ON po.po_headers USING btree (supplier_id)|f
po|po_headers|idx_po_headers_supplier_id|CREATE INDEX idx_po_headers_supplier_id ON po.po_headers USING btree (supplier_id)|f
po|po_headers|po_headers_po_number_key|CREATE UNIQUE INDEX po_headers_po_number_key ON po.po_headers USING btree (po_number)|t
po|po_lines|idx_po_line_header|CREATE INDEX idx_po_line_header ON po.po_lines USING btree (po_id)|f
po|po_lines|idx_po_line_item|CREATE INDEX idx_po_line_item ON po.po_lines USING btree (item_id)|f
po|po_lines|idx_po_line_status|CREATE INDEX idx_po_line_status ON po.po_lines USING btree (line_status)|f
po|po_lines|idx_po_lines_pr|CREATE INDEX idx_po_lines_pr ON po.po_lines USING btree (pr_id)|f
po|po_lines|idx_po_lines_source|CREATE INDEX idx_po_lines_source ON po.po_lines USING btree (source)|f
po|po_releases|idx_pm_por_po|CREATE INDEX idx_pm_por_po ON po.po_releases USING btree (po_id)|f
po|po_shipments|idx_po_ship_header|CREATE INDEX idx_po_ship_header ON po.po_shipments USING btree (po_id)|f
po|po_shipments|idx_po_ship_line|CREATE INDEX idx_po_ship_line ON po.po_shipments USING btree (po_line_id)|f
po|po_shipments|idx_po_ship_status|CREATE INDEX idx_po_ship_status ON po.po_shipments USING btree (status)|f
po|po_shipments|idx_po_ship_warehouse|CREATE INDEX idx_po_ship_warehouse ON po.po_shipments USING btree (ship_to_warehouse_id)|f
po|pr_approvals|idx_pm_pr_aprv_pr|CREATE INDEX idx_pm_pr_aprv_pr ON po.pr_approvals USING btree (pr_id)|f
po|pr_approvals|idx_pm_pr_aprv_status|CREATE INDEX idx_pm_pr_aprv_status ON po.pr_approvals USING btree (status)|f
po|pr_approvals|idx_pr_approvals_pr|CREATE INDEX idx_pr_approvals_pr ON po.pr_approvals USING btree (pr_id)|f
po|pr_distributions|idx_pr_dist_line|CREATE INDEX idx_pr_dist_line ON po.pr_distributions USING btree (pr_line_id)|f
po|pr_distributions|idx_pr_dist_pr|CREATE INDEX idx_pr_dist_pr ON po.pr_distributions USING btree (pr_id)|f
po|pr_headers|idx_pm_pr_requester|CREATE INDEX idx_pm_pr_requester ON po.pr_headers USING btree (requester_id)|f
po|pr_headers|idx_pm_pr_status|CREATE INDEX idx_pm_pr_status ON po.pr_headers USING btree (status)|f
po|pr_headers|idx_pr_headers_bu|CREATE INDEX idx_pr_headers_bu ON po.pr_headers USING btree (bu_id)|f
po|pr_headers|idx_pr_headers_requester|CREATE INDEX idx_pr_headers_requester ON po.pr_headers USING btree (requester_id)|f
po|pr_headers|idx_pr_headers_status|CREATE INDEX idx_pr_headers_status ON po.pr_headers USING btree (status)|f
po|pr_headers|idx_pr_status|CREATE INDEX idx_pr_status ON po.pr_headers USING btree (status)|f
po|pr_headers|pr_headers_pr_number_key|CREATE UNIQUE INDEX pr_headers_pr_number_key ON po.pr_headers USING btree (pr_number)|t
po|pr_lines|idx_pm_pr_line_header|CREATE INDEX idx_pm_pr_line_header ON po.pr_lines USING btree (pr_id)|f
po|pr_lines|idx_pr_line_header|CREATE INDEX idx_pr_line_header ON po.pr_lines USING btree (pr_id)|f
po|pr_lines|idx_pr_lines_item|CREATE INDEX idx_pr_lines_item ON po.pr_lines USING btree (item_id)|f
po|pr_lines|idx_pr_lines_po|CREATE INDEX idx_pr_lines_po ON po.pr_lines USING btree (po_id)|f
po|pr_lines|idx_pr_lines_pr|CREATE INDEX idx_pr_lines_pr ON po.pr_lines USING btree (pr_id)|f
po|receiving_headers|idx_pm_rec_po|CREATE INDEX idx_pm_rec_po ON po.receiving_headers USING btree (po_id)|f
po|receiving_headers|idx_pm_rec_status|CREATE INDEX idx_pm_rec_status ON po.receiving_headers USING btree (status)|f
po|receiving_headers|idx_pm_rec_warehouse|CREATE INDEX idx_pm_rec_warehouse ON po.receiving_headers USING btree (warehouse_id)|f
po|receiving_headers|idx_rec_po|CREATE INDEX idx_rec_po ON po.receiving_headers USING btree (po_id)|f
po|receiving_headers|receiving_headers_receipt_number_key|CREATE UNIQUE INDEX receiving_headers_receipt_number_key ON po.receiving_headers USING btree (receipt_number)|t
po|receiving_inspection|idx_pm_ri_line|CREATE INDEX idx_pm_ri_line ON po.receiving_inspection USING btree (receipt_line_id)|f
po|receiving_lines|idx_pm_rl_header|CREATE INDEX idx_pm_rl_header ON po.receiving_lines USING btree (receipt_id)|f
po|receiving_lines|idx_pm_rl_item|CREATE INDEX idx_pm_rl_item ON po.receiving_lines USING btree (item_id)|f
po|receiving_lines|idx_pm_rl_po_line|CREATE INDEX idx_pm_rl_po_line ON po.receiving_lines USING btree (po_line_id)|f
po|receiving_lines|idx_rec_line_header|CREATE INDEX idx_rec_line_header ON po.receiving_lines USING btree (receipt_id)|f
po|receiving_returns|idx_pm_rr_line|CREATE INDEX idx_pm_rr_line ON po.receiving_returns USING btree (receipt_line_id)|f
po|rfq_headers|idx_pm_rfq_buyer|CREATE INDEX idx_pm_rfq_buyer ON po.rfq_headers USING btree (buyer_id)|f
po|rfq_headers|idx_pm_rfq_status|CREATE INDEX idx_pm_rfq_status ON po.rfq_headers USING btree (status)|f
po|rfq_headers|rfq_headers_rfq_number_key|CREATE UNIQUE INDEX rfq_headers_rfq_number_key ON po.rfq_headers USING btree (rfq_number)|t
po|rfq_lines|idx_pm_rfq_line_header|CREATE INDEX idx_pm_rfq_line_header ON po.rfq_lines USING btree (rfq_id)|f
po|rfq_quotation_lines|idx_pm_ql_quotation|CREATE INDEX idx_pm_ql_quotation ON po.rfq_quotation_lines USING btree (quotation_id)|f
po|rfq_quotations|idx_pm_quot_partner|CREATE INDEX idx_pm_quot_partner ON po.rfq_quotations USING btree (partner_id)|f
po|rfq_quotations|idx_pm_quot_rfq|CREATE INDEX idx_pm_quot_rfq ON po.rfq_quotations USING btree (rfq_id)|f
po|supplier_categories|idx_pm_sc_code|CREATE INDEX idx_pm_sc_code ON po.supplier_categories USING btree (category_code)|f
po|supplier_categories|supplier_categories_category_code_key|CREATE UNIQUE INDEX supplier_categories_category_code_key ON po.supplier_categories USING btree (category_code)|t
po|supplier_contacts|idx_pm_scontact_partner|CREATE INDEX idx_pm_scontact_partner ON po.supplier_contacts USING btree (partner_id)|f
po|supplier_contacts|idx_pm_scontact_primary|CREATE INDEX idx_pm_scontact_primary ON po.supplier_contacts USING btree (partner_id) WHERE (is_primary = true)|f
po|supplier_performance|idx_pm_sperf_partner|CREATE INDEX idx_pm_sperf_partner ON po.supplier_performance USING btree (partner_id)|f
po|supplier_performance|idx_pm_sperf_period|CREATE INDEX idx_pm_sperf_period ON po.supplier_performance USING btree (period_name)|f
prod|__drizzle_migrations|__drizzle_migrations_hash_key|CREATE UNIQUE INDEX __drizzle_migrations_hash_key ON prod.__drizzle_migrations USING btree (hash)|t
prod|bom_components_ext|idx_prod_bce_bom|CREATE INDEX idx_prod_bce_bom ON prod.bom_components_ext USING btree (bom_id)|f
prod|engineering_change_orders|engineering_change_orders_eco_number_key|CREATE UNIQUE INDEX engineering_change_orders_eco_number_key ON prod.engineering_change_orders USING btree (eco_number)|t
prod|import_interface|import_interface_source_transaction_id_key|CREATE UNIQUE INDEX import_interface_source_transaction_id_key ON prod.import_interface USING btree (source_transaction_id)|t
prod|mps_entries|idx_prod_mps_item|CREATE INDEX idx_prod_mps_item ON prod.mps_entries USING btree (item_id)|f
prod|mrp_recommendations|idx_prod_mrp_item|CREATE INDEX idx_prod_mrp_item ON prod.mrp_recommendations USING btree (item_id)|f
prod|mv_production_progress|idx_mv_prod_progress_pk|CREATE UNIQUE INDEX idx_mv_prod_progress_pk ON prod.mv_production_progress USING btree (wo_id)|t
prod|prod_work_orders|prod_work_orders_wo_number_key|CREATE UNIQUE INDEX prod_work_orders_wo_number_key ON prod.prod_work_orders USING btree (wo_number)|t
prod|production_calendar|production_calendar_calendar_code_key|CREATE UNIQUE INDEX production_calendar_calendar_code_key ON prod.production_calendar USING btree (calendar_code)|t
prod|resources|idx_prod_res_wc|CREATE INDEX idx_prod_res_wc ON prod.resources USING btree (work_center_id)|f
prod|resources|resources_resource_code_key|CREATE UNIQUE INDEX resources_resource_code_key ON prod.resources USING btree (resource_code)|t
prod|wip_movements|idx_prod_wm_wo|CREATE INDEX idx_prod_wm_wo ON prod.wip_movements USING btree (work_order_id)|f
prod|work_centers|work_centers_center_code_key|CREATE UNIQUE INDEX work_centers_center_code_key ON prod.work_centers USING btree (center_code)|t
prod|work_order_operations|idx_prod_woo_wo|CREATE INDEX idx_prod_woo_wo ON prod.work_order_operations USING btree (work_order_id)|f
prod|work_order_requirements|idx_prod_wor_wo|CREATE INDEX idx_prod_wor_wo ON prod.work_order_requirements USING btree (work_order_id)|f
prod|workflow_definitions|workflow_definitions_workflow_code_key|CREATE UNIQUE INDEX workflow_definitions_workflow_code_key ON prod.workflow_definitions USING btree (workflow_code)|t
public|core.bom_headers|core.bom_headers_parent_item_id_unique|CREATE UNIQUE INDEX "core.bom_headers_parent_item_id_unique" ON public."core.bom_headers" USING btree (parent_item_id)|t
public|core.business_units|core.business_units_bu_code_unique|CREATE UNIQUE INDEX "core.business_units_bu_code_unique" ON public."core.business_units" USING btree (bu_code)|t
public|core.companies|core.companies_company_code_unique|CREATE UNIQUE INDEX "core.companies_company_code_unique" ON public."core.companies" USING btree (company_code)|t
public|core.item_categories|core.item_categories_category_code_unique|CREATE UNIQUE INDEX "core.item_categories_category_code_unique" ON public."core.item_categories" USING btree (category_code)|t
public|core.items|core.items_item_code_unique|CREATE UNIQUE INDEX "core.items_item_code_unique" ON public."core.items" USING btree (item_code)|t
public|core.partners|core.partners_partner_code_unique|CREATE UNIQUE INDEX "core.partners_partner_code_unique" ON public."core.partners" USING btree (partner_code)|t
public|core.system_config|core.system_config_config_key_unique|CREATE UNIQUE INDEX "core.system_config_config_key_unique" ON public."core.system_config" USING btree (config_key)|t
public|core.users|core.users_email_unique|CREATE UNIQUE INDEX "core.users_email_unique" ON public."core.users" USING btree (email)|t
public|core.users|core.users_username_unique|CREATE UNIQUE INDEX "core.users_username_unique" ON public."core.users" USING btree (username)|t
qc|__drizzle_migrations|__drizzle_migrations_hash_key|CREATE UNIQUE INDEX __drizzle_migrations_hash_key ON qc.__drizzle_migrations USING btree (hash)|t
qc|ai_agent_logs|idx_ai_agent_logs_agent|CREATE INDEX idx_ai_agent_logs_agent ON qc.ai_agent_logs USING btree (agent_name)|f
qc|ai_agent_logs|idx_ai_agent_logs_exec|CREATE INDEX idx_ai_agent_logs_exec ON qc.ai_agent_logs USING btree (execution_id)|f
qc|ai_agent_logs|idx_ai_agent_logs_time|CREATE INDEX idx_ai_agent_logs_time ON qc.ai_agent_logs USING btree (created_at DESC)|f
qc|ai_agent_logs|idx_ai_agent_logs_type|CREATE INDEX idx_ai_agent_logs_type ON qc.ai_agent_logs USING btree (log_type_code)|f
qc|ai_decisions|ai_decisions_uk1|CREATE UNIQUE INDEX ai_decisions_uk1 ON qc.ai_decisions USING btree (decision_code, tenant_id)|t
qc|ai_decisions|idx_ai_decisions_model|CREATE INDEX idx_ai_decisions_model ON qc.ai_decisions USING btree (model_id)|f
qc|ai_decisions|idx_ai_decisions_status|CREATE INDEX idx_ai_decisions_status ON qc.ai_decisions USING btree (decision_status_code)|f
qc|ai_decisions|idx_ai_decisions_type|CREATE INDEX idx_ai_decisions_type ON qc.ai_decisions USING btree (decision_type_code)|f
qc|ai_model_registry|ai_model_registry_uk1|CREATE UNIQUE INDEX ai_model_registry_uk1 ON qc.ai_model_registry USING btree (model_code, model_version, tenant_id)|t
qc|ai_model_registry|idx_ai_model_registry_active|CREATE INDEX idx_ai_model_registry_active ON qc.ai_model_registry USING btree (registry_id) WHERE ((model_status_code)::text = 'ACTIVE'::text)|f
qc|ai_model_registry|idx_ai_model_registry_card|CREATE INDEX idx_ai_model_registry_card ON qc.ai_model_registry USING gin (model_card)|f
qc|ai_model_registry|idx_ai_model_registry_stage|CREATE INDEX idx_ai_model_registry_stage ON qc.ai_model_registry USING btree (model_stage)|f
qc|ai_model_registry|idx_ai_model_registry_type|CREATE INDEX idx_ai_model_registry_type ON qc.ai_model_registry USING btree (model_type_code)|f
qc|ai_workflow_state|ai_workflow_state_uk1|CREATE UNIQUE INDEX ai_workflow_state_uk1 ON qc.ai_workflow_state USING btree (execution_id)|t
qc|ai_workflow_state|idx_ai_workflow_state_data|CREATE INDEX idx_ai_workflow_state_data ON qc.ai_workflow_state USING gin (state_data)|f
qc|ai_workflow_state|idx_ai_workflow_state_name|CREATE INDEX idx_ai_workflow_state_name ON qc.ai_workflow_state USING btree (workflow_name)|f
qc|ai_workflow_state|idx_ai_workflow_state_status|CREATE INDEX idx_ai_workflow_state_status ON qc.ai_workflow_state USING btree (workflow_status_code)|f
qc|inspection_orders|idx_qc_orders_source|CREATE INDEX idx_qc_orders_source ON qc.inspection_orders USING btree (source_type, source_line_id)|f
qc|mv_inspection_pass_rate|idx_mv_qc_pass_rate_pk|CREATE UNIQUE INDEX idx_mv_qc_pass_rate_pk ON qc.mv_inspection_pass_rate USING btree (plan_name, disposition)|t
qc|qc_agent_definitions|idx_qc_agent_definitions_active|CREATE INDEX idx_qc_agent_definitions_active ON qc.qc_agent_definitions USING btree (agent_definition_id) WHERE ((is_active)::text = 'Y'::text)|f
qc|qc_agent_definitions|idx_qc_agent_definitions_tools|CREATE INDEX idx_qc_agent_definitions_tools ON qc.qc_agent_definitions USING gin (tools)|f
qc|qc_agent_definitions|idx_qc_agent_definitions_type|CREATE INDEX idx_qc_agent_definitions_type ON qc.qc_agent_definitions USING btree (agent_type_code)|f
qc|qc_agent_definitions|qc_agent_definitions_uk1|CREATE UNIQUE INDEX qc_agent_definitions_uk1 ON qc.qc_agent_definitions USING btree (agent_code, agent_version, tenant_id)|t
qc|qc_algorithms|idx_qc_algorithms_active|CREATE INDEX idx_qc_algorithms_active ON qc.qc_algorithms USING btree (algorithm_id) WHERE ((is_active)::text = 'Y'::text)|f
qc|qc_algorithms|idx_qc_algorithms_type|CREATE INDEX idx_qc_algorithms_type ON qc.qc_algorithms USING btree (algorithm_type_code)|f
qc|qc_algorithms|qc_algorithms_uk1|CREATE UNIQUE INDEX qc_algorithms_uk1 ON qc.qc_algorithms USING btree (algorithm_code, tenant_id)|t
qc|qc_audit_findings|idx_qc_audit_findings_audit|CREATE INDEX idx_qc_audit_findings_audit ON qc.qc_audit_findings USING btree (audit_id)|f
qc|qc_audit_findings|idx_qc_audit_findings_open|CREATE INDEX idx_qc_audit_findings_open ON qc.qc_audit_findings USING btree (audit_finding_id) WHERE ((finding_status_code)::text <> ALL ((ARRAY['CLOSED'::character varying, 'VERIFIED'::character varying])::text[]))|f
qc|qc_audit_findings|idx_qc_audit_findings_severity|CREATE INDEX idx_qc_audit_findings_severity ON qc.qc_audit_findings USING btree (finding_severity_code)|f
qc|qc_audit_findings|idx_qc_audit_findings_status|CREATE INDEX idx_qc_audit_findings_status ON qc.qc_audit_findings USING btree (finding_status_code)|f
qc|qc_audit_findings|idx_qc_audit_findings_type|CREATE INDEX idx_qc_audit_findings_type ON qc.qc_audit_findings USING btree (finding_type_code)|f
qc|qc_audit_findings|qc_audit_findings_uk1|CREATE UNIQUE INDEX qc_audit_findings_uk1 ON qc.qc_audit_findings USING btree (audit_id, finding_number)|t
qc|qc_audits|idx_qc_audits_active|CREATE INDEX idx_qc_audits_active ON qc.qc_audits USING btree (audit_id) WHERE ((is_active)::text = 'Y'::text)|f
qc|qc_audits|idx_qc_audits_dates|CREATE INDEX idx_qc_audits_dates ON qc.qc_audits USING btree (planned_start_date, planned_end_date)|f
qc|qc_audits|idx_qc_audits_standard|CREATE INDEX idx_qc_audits_standard ON qc.qc_audits USING btree (audit_standard_code)|f
qc|qc_audits|idx_qc_audits_status|CREATE INDEX idx_qc_audits_status ON qc.qc_audits USING btree (audit_status_code)|f
qc|qc_audits|idx_qc_audits_type|CREATE INDEX idx_qc_audits_type ON qc.qc_audits USING btree (audit_type_code)|f
qc|qc_audits|qc_audits_uk1|CREATE UNIQUE INDEX qc_audits_uk1 ON qc.qc_audits USING btree (audit_number, tenant_id)|t
qc|qc_capa_actions|idx_qc_capa_actions_assigned|CREATE INDEX idx_qc_capa_actions_assigned ON qc.qc_capa_actions USING btree (assigned_to)|f
qc|qc_capa_actions|idx_qc_capa_actions_capa|CREATE INDEX idx_qc_capa_actions_capa ON qc.qc_capa_actions USING btree (capa_id)|f
qc|qc_capa_actions|idx_qc_capa_actions_status|CREATE INDEX idx_qc_capa_actions_status ON qc.qc_capa_actions USING btree (action_status_code)|f
qc|qc_capa_actions|qc_capa_actions_uk1|CREATE UNIQUE INDEX qc_capa_actions_uk1 ON qc.qc_capa_actions USING btree (capa_id, action_sequence)|t
qc|qc_capa_headers|idx_qc_capa_headers_due|CREATE INDEX idx_qc_capa_headers_due ON qc.qc_capa_headers USING btree (due_date)|f
qc|qc_capa_headers|idx_qc_capa_headers_ncr|CREATE INDEX idx_qc_capa_headers_ncr ON qc.qc_capa_headers USING btree (source_ncr_id)|f
qc|qc_capa_headers|idx_qc_capa_headers_open|CREATE INDEX idx_qc_capa_headers_open ON qc.qc_capa_headers USING btree (capa_id) WHERE ((capa_status_code)::text <> ALL ((ARRAY['CLOSED'::character varying, 'CANCELLED'::character varying])::text[]))|f
qc|qc_capa_headers|idx_qc_capa_headers_priority|CREATE INDEX idx_qc_capa_headers_priority ON qc.qc_capa_headers USING btree (capa_priority_code)|f
qc|qc_capa_headers|idx_qc_capa_headers_status|CREATE INDEX idx_qc_capa_headers_status ON qc.qc_capa_headers USING btree (capa_status_code)|f
qc|qc_capa_headers|idx_qc_capa_headers_type|CREATE INDEX idx_qc_capa_headers_type ON qc.qc_capa_headers USING btree (capa_type_code)|f
qc|qc_capa_headers|qc_capa_headers_uk1|CREATE UNIQUE INDEX qc_capa_headers_uk1 ON qc.qc_capa_headers USING btree (capa_number, tenant_id)|t
qc|qc_characteristic_value_sets|idx_qc_char_val_sets_char|CREATE INDEX idx_qc_char_val_sets_char ON qc.qc_characteristic_value_sets USING btree (characteristic_id)|f
qc|qc_characteristic_value_sets|qc_char_val_sets_uk1|CREATE UNIQUE INDEX qc_char_val_sets_uk1 ON qc.qc_characteristic_value_sets USING btree (characteristic_id, value_code)|t
qc|qc_characteristics|idx_qc_characteristics_active|CREATE INDEX idx_qc_characteristics_active ON qc.qc_characteristics USING btree (characteristic_id) WHERE ((is_active)::text = 'Y'::text)|f
qc|qc_characteristics|idx_qc_characteristics_type|CREATE INDEX idx_qc_characteristics_type ON qc.qc_characteristics USING btree (characteristic_type_code)|f
qc|qc_characteristics|qc_characteristics_uk1|CREATE UNIQUE INDEX qc_characteristics_uk1 ON qc.qc_characteristics USING btree (characteristic_code, tenant_id)|t
qc|qc_complaint_investigations|idx_qc_complaint_investigations_complaint|CREATE INDEX idx_qc_complaint_investigations_complaint ON qc.qc_complaint_investigations USING btree (complaint_id)|f
qc|qc_control_plan_characteristics|idx_qc_cp_characteristics_char|CREATE INDEX idx_qc_cp_characteristics_char ON qc.qc_control_plan_characteristics USING btree (characteristic_id)|f
qc|qc_control_plan_characteristics|idx_qc_cp_characteristics_op|CREATE INDEX idx_qc_cp_characteristics_op ON qc.qc_control_plan_characteristics USING btree (operation_code)|f
qc|qc_control_plan_characteristics|idx_qc_cp_characteristics_plan|CREATE INDEX idx_qc_cp_characteristics_plan ON qc.qc_control_plan_characteristics USING btree (control_plan_id)|f
qc|qc_control_plan_characteristics|qc_cp_characteristics_uk1|CREATE UNIQUE INDEX qc_cp_characteristics_uk1 ON qc.qc_control_plan_characteristics USING btree (control_plan_id, characteristic_id)|t
qc|qc_control_plans|idx_qc_control_plans_item|CREATE INDEX idx_qc_control_plans_item ON qc.qc_control_plans USING btree (item_id)|f
qc|qc_control_plans|idx_qc_control_plans_status|CREATE INDEX idx_qc_control_plans_status ON qc.qc_control_plans USING btree (control_plan_status)|f
qc|qc_control_plans|idx_qc_control_plans_type|CREATE INDEX idx_qc_control_plans_type ON qc.qc_control_plans USING btree (control_plan_type_code)|f
qc|qc_control_plans|qc_control_plans_uk1|CREATE UNIQUE INDEX qc_control_plans_uk1 ON qc.qc_control_plans USING btree (control_plan_number, tenant_id)|t
qc|qc_cost_of_quality|idx_qc_coq_category|CREATE INDEX idx_qc_coq_category ON qc.qc_cost_of_quality USING btree (coq_category_code)|f
qc|qc_cost_of_quality|idx_qc_coq_date|CREATE INDEX idx_qc_coq_date ON qc.qc_cost_of_quality USING btree (transaction_date)|f
qc|qc_cost_of_quality|idx_qc_coq_item|CREATE INDEX idx_qc_coq_item ON qc.qc_cost_of_quality USING btree (coq_item_code)|f
qc|qc_cost_of_quality|idx_qc_coq_org|CREATE INDEX idx_qc_coq_org ON qc.qc_cost_of_quality USING btree (organization_id)|f
qc|qc_cost_of_quality|qc_cost_of_quality_uk1|CREATE UNIQUE INDEX qc_cost_of_quality_uk1 ON qc.qc_cost_of_quality USING btree (coq_number, tenant_id)|t
qc|qc_customer_complaints|idx_qc_complaints_customer|CREATE INDEX idx_qc_complaints_customer ON qc.qc_customer_complaints USING btree (customer_id)|f
qc|qc_customer_complaints|idx_qc_complaints_item|CREATE INDEX idx_qc_complaints_item ON qc.qc_customer_complaints USING btree (item_id)|f
qc|qc_customer_complaints|idx_qc_complaints_open|CREATE INDEX idx_qc_complaints_open ON qc.qc_customer_complaints USING btree (complaint_id) WHERE ((complaint_status_code)::text <> ALL ((ARRAY['CLOSED'::character varying, 'CANCELLED'::character varying])::text[]))|f
qc|qc_customer_complaints|idx_qc_complaints_severity|CREATE INDEX idx_qc_complaints_severity ON qc.qc_customer_complaints USING btree (complaint_severity_code)|f
qc|qc_customer_complaints|idx_qc_complaints_status|CREATE INDEX idx_qc_complaints_status ON qc.qc_customer_complaints USING btree (complaint_status_code)|f
qc|qc_customer_complaints|idx_qc_complaints_type|CREATE INDEX idx_qc_complaints_type ON qc.qc_customer_complaints USING btree (complaint_type_code)|f
qc|qc_customer_complaints|qc_customer_complaints_uk1|CREATE UNIQUE INDEX qc_customer_complaints_uk1 ON qc.qc_customer_complaints USING btree (complaint_number, tenant_id)|t
qc|qc_defect_master|idx_qc_defect_master_active|CREATE INDEX idx_qc_defect_master_active ON qc.qc_defect_master USING btree (defect_id) WHERE ((is_active)::text = 'Y'::text)|f
qc|qc_defect_master|idx_qc_defect_master_severity|CREATE INDEX idx_qc_defect_master_severity ON qc.qc_defect_master USING btree (defect_severity_code)|f
qc|qc_defect_master|idx_qc_defect_master_type|CREATE INDEX idx_qc_defect_master_type ON qc.qc_defect_master USING btree (defect_type_code)|f
qc|qc_defect_master|qc_defect_master_uk1|CREATE UNIQUE INDEX qc_defect_master_uk1 ON qc.qc_defect_master USING btree (defect_code, tenant_id)|t
qc|qc_defect_occurrences|idx_qc_defect_occurrences_date|CREATE INDEX idx_qc_defect_occurrences_date ON qc.qc_defect_occurrences USING btree (occurrence_date)|f
